,Unnamed: 0,name,tags,url,calories,serving_size,ingredients
541,579,Shrimp Alfredo,"['Milk', 'Shellfish', 'Soy']",/menus/item/2a4de01b-7581-4ab0-b6ae-dc2886751720,216,3/4cups," GF Alfredo Sauce  (Cream, Skim Milk, Water, Parmesan And Asiago Cheese Blend With Flavor  (Parmesan And Asiago Cheeses [Cultured Milk, Salt, Enzymes], Enzyme Modified Parmesan Cheese [Cultured Milk, Water, Salt, Enzymes], Whey, Salt), Soybean Oil, Canola Oil, 2% Or Less Of Modified Cornstarch, Salt, Romano Cheese Made From Cow's Milk Cultured Milk, Salt, Enzymes), Lactose, Spice, Xanthan Gum, Datem, Mono- And Diglycerides, Seasoning  (Cornstarch, Extractives Of Turmeric And Annatto, Natural Flavor), Seasoning  (Maltodextrin, Flavor, Enzyme Modified Butterfat).), Salad Shrimp  (Shrimp, Water, Salt, Sodium Tripolyphosphate  (To Retain Moisture), Sodium Bisulfite  (As A Preservative).)"
542,580,Fettuccine,"['Gluten', 'Wheat', 'Vegan', 'Vegetarian']",/menus/item/44698b92-43f8-40e4-b7ad-83675f5ef985,198,1cup," Water  (Water), Pasta Fettuccine 20#  (Semolina Wheat, Durum Wheat Flour, Vitamin B3 Niacin, Iron Ferrous Sulfate, Vitamin B1 Thiamine Mononitrate, Vitamin B2 Riboflavin, Folic Acid), Iodized Salt  (Salt, Sodium Silicoaluminate, Dextrose, Potassium Iodine), Canola Oil  (Canola Oil With TBHQ And Citric Acid Added To Help Protect Flavor. Dimethylpolysiloxane, An Antifoaming Agent, Added.)"
543,581,Steakhouse Pork Chop,[],/menus/item/d432b8ad-ccfb-4d2c-a072-21df3ed1934e,394,6 ozchop," Pork Chop 6oz Bone In, Canola Oil  (Canola Oil With TBHQ And Citric Acid Added To Help Protect Flavor. Dimethylpolysiloxane, An Antifoaming Agent, Added.), Coarse Kosher Salt  (Salt, Yellow Prussiate Of Soda), Spice Garlic Herb Granulated 18 oz  (Dehydrated Garlic, Spices, Dehydrated Onion, Orange Peel, Paprika  (As Color), Red Pepper), Spice Pepper Black Ground 18 oz  (Black Pepper)"
544,582,Ruby Wild Rice Blend,"['Vegan', 'Vegetarian']",/menus/item/64070989-4a03-4007-8b39-8732d8e5e8e6,115,1/2cup," Water  (Water), Rice Ruby Wild Blend 6x2#  (Long Grain Parboiled Brown Rice, Sprouted Brown Rice, Colusari Red Rice, Sprouted Red Rice, B Grade Wild Rice.)"
545,583,Roasted Cajun Chicken Drumsticks,[],/menus/item/ee24bea7-3b49-4ba4-8fdd-897b54002d76,77,1leg," Chicken Drumstick, Spice Cajun/Andouille Rub  (Salt, Spices, Onion Powder, Garlic Powder, Extractives Of Spice And Paprika.)"
546,584,Battered Fried Corn Nuggets,"['Eggs', 'Gluten', 'Milk', 'Soy', 'Wheat', 'Vegetarian']",/menus/item/72cec0da-50b5-430c-803d-0dadfc373b1e,127,4 nugget," Corn Nuggets Battered 12#  (Corn, Water, Bleached Enriched Wheat Flour  (Wheat Flour, Niacin, Reduced Iron, Thiamine Mononitrate, Riboflavin, Folic Acid), Sugar, Yellow Corn Flour, Modified Food Starch, Liquid Margarine  (Soybean Oil, Water, Salt, Hydrogenated Soybean Oil, Vegetable Monogylcerides, Soy Lecithin, Potassium Sorbate and Citric Acid [Preservatives], Artificial Flavor, Beta Carotene [Color], Vitamin A Palmitate Added), Contains Less Than 2% Of: Spice, Natural Flavors, Nonfat Milk, Egg, Whey, Dextrose, Salt, Corn Starch, Soy Flour, Leavening  (Sodium Acid Pyrophosphate, Sodium Bicarbonate), Sodium Alginate, Sodium Citrate, Sodium Tripolyphosate, Soybean Oil, Calcium Chloride, Oleoresin Paprika  (Color). Prefried in Vegetable Oil  (Soybean and/or Canola Oil).)"
547,585,Roasted Fingerling Potatoes,"['Vegan', 'Vegetarian']",/menus/item/c9b4be2b-1288-43ca-b9b8-2315c0c7bcda,242,4oz.," Potato Fingerling, Canola/Olive Oil Blend  (Canola Oil, Extra Virgin Olive Oil), Herb Parsley 60 Ct.  (Parsley), Spice Garlic Salt  (Salt, Dehydrated Garlic, Less Than 2% Silicon Dioxide To Prevent Caking), Spice Paprika Spanish  (Paprika)"
548,586,Mixed Vegetables,"['Vegan', 'Vegetarian']",/menus/item/6b0cc671-b1c8-4540-9b2e-bd2fb27681f0,57,1/2cup," Vegetable Mixed  (12 x 2.5#)  (Peas, Carrots, Corn, Green Beans, Lima Beans, Salt)"
549,587,Meat Lover's Pizza,"['Gluten', 'Milk', 'Soy', 'Wheat']",/menus/item/b617d50c-fc68-437b-973d-3e87889bb8cc,657,6cut," Dough Pizza Pan Sheeted 16""  (Enriched Unbleached Wheat Flour  (Wheat Flour, Malted Barley Flour, Niacin, Iron as Ferrous Sulfate, Thiamine Mononitrate, Enzyme, Riboflavin, Folic Acid), Water, Yeast, High Fructose Corn Syrup, Conatans Less Than 2% of the Following: Salt, Soybean Oil, Wheat Gluten, Ascorbic Acid, Enzyme.), Heinz Tomato Pizza Sauce  (Tomato Puree,  (Water, Tomato Paste), Salt, Sugar, Extra Virgin Olive Oil, Spices, Garlic Powder, Ascorbic Acid.), Shredded Cheese  (Paseurized Milk, Cheese Cultures, Salt, Enzymes.), Diced Ham  (Cured With Water, Salt, Sodium Phosphate, Potassium Acetate, Sodium Erythorbate, Potassium Diacetate, Sodium Nitrite), Bacon Bits  (Bacon Cured With Water, Salt, Sugar, Sodium Erythorbate, Sodium Nitrite. May Also Contain Dextrose, Flavoring, Honey, Dehydrated Pork Broth, Potassium Chloride, Potassium Lactate, Smoke Flavoring, Sodium Diacetate, Sodium Phosphate.), Sliced Pepperoni  (BHA, BHT With Citric Acid Added To Help Protect Flavor, Pork And Beef, Salt, Contains 2% Or Less Of: Water, Dextrose, Spices, Lactic Acid Starter Culture, Oleoresin Of Paprika, Garlic Powder, Sodium Nitrite, Citric Acid, BHA, BHT.), Sausage Crumble Cooked Mild  (Pork, Water, Textured Soy Flour, Seasoning  (Salt, Spices And Dextrose, Garlic), Caramel Color.)"
550,588,Italian Sausage,[],/menus/item/b3a5c7e9-3786-4dbb-82ae-e04ae959d613,782,2per," Sausage Italian Johnsonville  (Pork, Water, Corn Syrup, Less Than 2% Of The Following: Pork Broth With Natural Flavorings, Salt, Dextrose, Spices, Paprika, Natural Flavor, BHA, Propyl Gallate, Citric Acid.), Water  (Water), Tomato Diced 6 x #10  (Tomatoes, Tomato Juice, Less Than 2% Of: Salt, Calcium Chloride, Citric Acid.), Tomato Paste 6 x #10  (Tomato Paste, Citric Acid.), Celery, Yellow Onion, Pepper Green Diced  (12 x 2#)  (Green Pepper.), Iodized Salt  (Salt, Sodium Silicoaluminate, Dextrose, Potassium Iodine), Garlic Powder  (Garlic Powder.), Spice Pepper Black Ground 18 oz  (Black Pepper), Oregano  (Oregano), Spice Thyme Ground  (Thyme Leaves), Spice Parsley Flakes"
551,589,Banana Pudding,"['Coconut', 'Milk', 'Soy', 'Vegetarian']",/menus/item/3b3a5766-876a-4059-8c99-3814e3c7dc01,156,1/2cup," Vanilla Pudding  (2% Milk  (Grade A Reduced Fat Milk, Vitamin A Palmitate & Vitamin D3.), Vanilla Pudding  (Dextrose, Sugar, Modified Food Starch, Less Than 2% Of Disodium Phosphate, Tetrasodium Pyrophosphate, Tricalcium Phosphate, Natural And Artificial Flavor, Salt, Xanthan Gum, Nonfat Dry Milk, Mono And Diglycerides, Yellow 5, Yellow 6.)), Banana, Whpd Topping, Whipped Topping  (Water, Hydrogenated Vegetable Oil  (Palm, Palm Kernel, Coconut And/Or Cottonseed), High Fructose Corn Syrup, Contains Less Than 2% Of The Following: Carbohydrate Gum, Polysorbate 60, Salt, Polyglycerol Esters Of Fatty Acids, Soy Lecithin, Disodium Phosphate, Sodium Citrate, Xanthan Gum, Artificial Flavor, Natural Flavor, Colored With Turmeric And Annatto Extracts.), Water  (Water)"
552,590,Pesto Tortellini,"['Eggs', 'Gluten', 'Milk', 'Soy', 'Wheat', 'Vegetarian']",/menus/item/8a3d5f1b-3477-40b7-9f02-bdb53876e412,168,1/2cup," Water  (Water), Cheese Tortellini  (Dough Mixture: Enriched Semolina Flour  (Semolina Flour [Niacin, Ferrous Sulfate, Thiamine Mononitrate, Riboflavin, Folic Acid]), Water, Eggs, Turmeric. Filling: Ricotta Cheese  (Whey, Pasteurized Whole Milk, Skim Milk, Vinegar, Salt) Imported Romano Cheese  (Pasteurized Sheep’s Milk, Cheese Culture, Salt), Cracker Meal  (Enriched Wheat Flour [Niacin, Ferrous Sulfate, Thiamine Mononitrate, Riboflavin, Folic Acid), Soybean Oil, Potato Flakes  (Dehydrated Potatoes, Mono And Diglycerides [Preserved With Sodium Acid Pyrophosphate, Sodium Bisulfate And Citric Acid]), Salt, Garlic, Spices.), Sauce Pesto Kale Without Nuts  (Canola Oil, Kale, Water, Basil, Garlic, Parmesan Cheese  (Pasteurized Part Skim Cows' Milk, Cultures, Salt, Enzymes), Rice Vinegar, Spices, Salt, Salt Substitute  (Potassium Chloride, Rice Flour), Xanthan Gum, Citric Acid.)"
553,591,Panko Breaded Fish,"['Fish', 'Gluten', 'Milk', 'Wheat']",/menus/item/2ca93ba6-3fcb-4379-bf48-b07d1a364dc8,97,1piece," Fish Pollock Fillet Panko Brd 2-3 oz  (Alaska Pollock, Water, Bleached Enriched And Unenriched Wheat Flour  (Wheat Flour, Niacin, Iron, Thiamine Mononitrate, Riboflavin, Folic Acid), Modified Corn Starch, Yellow Corn Flour, Contains 2% Or Less Of: Salt, Whey, Yeast, Palm Oil, Leavening  (Baking Soda, Sodium Aluminum Phosphate), Garlic Powder, Onion Powder, Malted Barley Flour, Spice, Dextrose, Disodium Inosinate And Disodium Guanylate, Turmeric  (Color), Yeast Extract.)"
554,592,Tartar Sauce,"['Eggs', 'Soy', 'Vegetarian']",/menus/item/9ecaf4f9-aeb2-4e7f-b9b6-30e5c4029024,84,1tablespoon," Mayonnaise  (Soybean Oil, Vinegar, Eggs, Water, Salt, Egg Yolks, Sugar, Calcium Disodium EDTA  (To Protect Flavor), Dried Garlic, Dried Onions, Natural Flavor.), Nonpareil Capers  (Capers, Water, Salt, And Wine Vinegar.), Grey Poupon Mustard  (Distilled White Vinegar, Mustard Seed, Water, Salt, White Wine, Citric Acid, Tartaric Acid, Fruit Pectin, Sugar, Spices.), Lemon Juice  (Filtered Water, Lemon Juice Concentrate, Sodium Bisulfite  (Preservative), Sodium Benzoate  (Preservative), Lemon Oil), Shallots  (Raw Shallots.), Juice, Herb Parsley 60 Ct.  (Parsley), Minced Garlic  (Peeled Garlic), Spice Pepper Black Ground 18 oz  (Black Pepper)"
555,593,Malt Vinegar,"['Gluten', 'Vegan', 'Vegetarian']",/menus/item/d2cbf4e5-c35b-4e84-978e-a4d1a62f3377,0,1teaspoon," Malt Vinegar Barley, Corn Malt, Diluted With Water To 5 Acidity."
556,594,Lemon Wedges,"['Vegan', 'Vegetarian']",/menus/item/3c9c591a-4642-4536-b105-570c3baa41b7,3,1wedge, Lemon  (Lemons Fresh)
557,595,Hush Puppies,"['Eggs', 'Gluten', 'Milk', 'Soy', 'Wheat', 'Vegetarian']",/menus/item/c08358de-ace0-48d2-a99d-e95c017f27ba,49,hushpuppy," Hush Puppies Plain Original 2 x 5#  (Onion, Enriched Yellow Corn Meal  (Yellow Corn Meal, Niacin, Reduced Iron, Thiamine Mononitrate, Riboflavin, Folic Acid), Water, Enriched Wheat Flour  (Wheat Flour, Niacin, Reduced Iron, Thiamine Mononitrate, Riboflavin, Folic Acid), Soybean Oil, Sugar, Contains Less Than 2% Or Less: Buttermilk, Salt, Leavening  (Sodium Aluminum Phosphate, Sodium Bicarbonate), Spice, Dried Parsley, Guar Gum, Soy, And Eggs.)"
558,596,Roasted Pork Loin,[],/menus/item/ca336da0-68c0-4a23-a357-6386245bd4b7,204,4oz, Pork Loin Bnls Canadian Back 48# Avg  (Boneless Pork Loins)
559,597,Spicy Basil Tofu,"['Soy', 'Vegan', 'Vegetarian']",/menus/item/e71a8e30-5fb4-43be-a982-9115444979c1,2617,1batch," Tofu  (Non-GMO Soybeans, Water, Calcium Sulfate, Glucono Delta Lactone  (GDL).), Red Pepper  (Red Pepper), Sauce Soy Tamari GF  (Water, Soybeans, Salt, Alcohol  (To Preserve Freshness).), Water  (Water), Canola Oil  (Canola Oil With TBHQ And Citric Acid Added To Help Protect Flavor. Dimethylpolysiloxane, An Antifoaming Agent, Added.), Jalapeno Peppers  (Jalapeno Pepper.), Garlic Chopped  (Minced Garlic  (Peeled Garlic)), Fresh Basil  (Fresh Basil), Brown Sugar  (Sugar, Cane Molasses)"
560,598,Shredded Cheese,"['Milk', 'Vegetarian']",/menus/item/7374a586-2d84-4980-8652-b3c4d4a27a0d,97,1ounce," Paseurized Milk, Cheese Cultures, Salt, Enzymes."
561,599,Crushed Red Pepper,"['Vegan', 'Vegetarian']",/menus/item/13fa2fc2-0af2-4193-b215-826c3434fa5a,19,1tablespoon, Crushed Red Pepper
562,600,BBQ Chicken Breast,['Soy'],/menus/item/ce59d631-cb8e-4f5b-a992-b67481c705db,208,1serving," Chicken Breast Bnls Sknls 48x4 oz, Ken's Cannonball BBQ Sauce  (Sugar, Distilled Vinegar, Water, Tomato Paste, Molasses, Modified Potato Starch, Salt, Contains Less Than 2% Of Natural Smoke Flavor, Mustard Flour, Spice, Paprika, Onion, Garlic, Caramel Color, Maltodextrin, Chili Powder  (Chili Pepper, Spice, Salt, Garlic), Autolyzed Yeast Extract, Natural Flavor.), Rub Premium Blend BBQ  (Blended Of Sugar, Salt, Chili Pepper And Other Spices, Garlic Powder, Disodium Inosinate And Guanylate, And Less Than 2% Silicon Dioxide And Soybean Oil Added To Prevent Caking.), Water  (Water)"
563,601,Divinity Chunk Brownie,"['Eggs', 'Gluten', 'Milk', 'Soy', 'Wheat', 'Vegetarian']",/menus/item/3f695c98-2665-4864-b753-f41e99184f76,224,8x10cut," Mix Brownie Gm  (Sugar, Enriched Flour, Bleached  (Wheat Flour, Niacin, Iron, Thiamin Mononitrate, Riboflavin, Folic Acid), Palm Oil, Cocoa Processed With Alkali, Soybean Oil. Contains 2% Or Less Of: Corn Starch, Egg White, Salt, Leavening  (Baking Soda, Monocalcium Phosphate), Natural Flavor, Soy Flour, Nonfat Milk.), White Vanilla Chocolate Chips  (Sugar, Skim Milk, Hydrogenated Vegetable Oil  (Palm Kernel Oil, Soybean Oil, Palm Oil), Palm Kernel Oil, Contains Less Than 2% Or Less Of: Artificial Flavor, Lecithin  (Soy), Salt.), Water  (Water), Marshmallow Cream 5 Gal Pail  (Corn Syrup, Sugar, Water, Egg Whites, Artificial Flavors, Xanthan Gum, Lactic Acid And Salt.), Water  (Water)"
564,602,Vegetable Lasagna,"['Eggs', 'Gluten', 'Milk', 'Soy', 'Wheat', 'Vegetarian']",/menus/item/15138747-87d9-404d-9b60-7e9a3c48622d,232,4x4cut," Pasta Lasagna Vegetable Stouffer's  (Blanched Lasagna  (Water, Grain Blend With Whole Wheat Flour [Durum Whole Wheat Flour, Semolina], Dried Egg Whites), Skim Milk, Water, Low Fat Ricotta Cheese  (Pasteurized Whey, Pasteurized Milk, Pasteurized Cream, Vinegar, Carrageenan, Xanthan Gum), Low-Moisture Part-Skim Mozzarella Cheese  (Cultured Part-Skim Milk, Salt, Enzymes), Carrots, Breadcrumbs  (Wheat Flour, Sugar, Yeast, Soybean Oil, Salt), Parmesan And Asiago Cheese Blend With Flavor  (Parmesan And Asiago Cheeses [Cultured Milk, Salt, Enzymes], Enzyme Modified Parmesan Cheese [Cultured Milk, Water, Salt, Enzymes], Whey, Salt), Spinach, 2% Or Less Of Onions, Modified Cornstarch, Soybean Oil, Bread Crumbs  (Bleached Wheat Flour Contains 2% Or Less Of: Sugar, Yeast, Salt), Broccoli, Parmesan Cheese Paste  (Granular And Parmesan Cheese [Cultured Milk, Salt, Enzymes], Water, Salt, Lactic Acid, Citric Acid), Romano Cheese With Flavor  (Romano Cheese [Cultured Cow's Milk, Salt, Enzymes], Enzyme Modified Romano Cheese [Romano Cheese {Cultured Cow's Milk, Water, Salt, Enzymes}, Salt]), Bleached Enriched Wheat Flour  (Wheat Flour, Niacin, Reduced Iron, Thiamin Mononitrate, Riboflavin, Folic Acid), Sea Salt, Sugar, Seasoning  (Maltodextrin, Flavoring, Modified Cornstarch, Lipolyzed Cream [Butter, Nonfat Milk Solids], Sodium Citrate), Potassium Chloride, Spices, Whey, Whey Protein Concentrate, Xanthan Gum, Garlic, Dried Onions, Flavors, Datem, Mono- And Diglycerides.)"
565,603,Chocolate Chip Muffin,"['Eggs', 'Gluten', 'Milk', 'Soy', 'Wheat', 'Vegetarian']",/menus/item/a5379404-bc57-4b5e-834e-55e604410f7a,352,1muffin," Muffin Mix Variety  (Enriched Flour Bleached  (Wheat Flour, Niacin, Iron, Thiamin Mononitrate, Riboflavin, Folic Acid), Sugar, Palm Oil, Modified Corn Starch, Modified Whey. Contains 2% Or Less Of: Leavening  (Sodium Acid Pyrophosphate, Baking Soda, Monocalcium Phosphate), Dextrose, Mono And Diglycerides, Salt, Eggs With Sodium Silicoaluminate, Xanthan Gum, Nonfat Milk, Natural Flavor, Soy Flour.), Water  (Water), Mini Chocolate Chips  (Semi-Sweet Chocolate  (Sugar, Chocolate, Cocoa Butter, Milk Fat, Soy Lecithin, Natural Flavor, Milk).)"
566,604,Smoked Baby Back Ribs,[],/menus/item/aeffd50c-7541-424f-b667-9eb5620f1aae,132,1piece," Pork Rib Baby Back 2.0 Up 3 Pc 28# AvgCs, Spice Rib & Brisket Rub  (Blended Of Salt, Sugar, Spices, Chili Powder  (Chili Pepper, Spices, Salt, Garlic Powder), Garlic Powder, Disodium Inosinate Guanylate, And Less Than 2% Silicon Dioxide Added To Prevent Caking.)"
567,605,BBQ Tofu and Peppers,"['Soy', 'Vegan', 'Vegetarian']",/menus/item/2faf8828-0e29-4f39-966e-0859b6a8ad17,320,1cup," Tofu  (Non-GMO Soybeans, Water, Calcium Sulfate, Glucono Delta Lactone  (GDL).), Ken's Cannonball BBQ Sauce  (Sugar, Distilled Vinegar, Water, Tomato Paste, Molasses, Modified Potato Starch, Salt, Contains Less Than 2% Of Natural Smoke Flavor, Mustard Flour, Spice, Paprika, Onion, Garlic, Caramel Color, Maltodextrin, Chili Powder  (Chili Pepper, Spice, Salt, Garlic), Autolyzed Yeast Extract, Natural Flavor.), Red Pepper  (Red Pepper), Green Pepper  (Green Pepper), Onion White Slab Sliced 4 x 5#"
568,606,Iced Chocolate Cake,"['Eggs', 'Gluten', 'Milk', 'Soy', 'Wheat', 'Vegetarian']",/menus/item/7de5ab83-f966-4c27-92c8-733dcd5d3a1b,194,5 x 8cut," Sugar, Enriched Bleached Flour  (Wheat Flour, Niacin, Reduced Iron, Thiamine Mononitrate, Riboflavin, Folic Acid), Vegetable Oil  (Soybean, Palm), Eggs, Skim Milk, High Fructose Corn Syrup, Corn Syrup, Cocoa Processed With Alkali, Contains 2% Or Less: Chocolate Processed With Alkali, Baking Soda, Mono- And Diglycerides, Salt, Modified Food Starch, Nonfat Dry Milk, Artificial Flavor, Esters Of Fatty Acids, Sodium Alginate, Corn Starch, Sodium Aluminum Phosphate, Red 40, Yellow 6, Blue 1, Soy Lecithin, Polysorbate 60, Gum Arabic, Gellan Gum, Sodium Stearoyl Lactylate, Disodium Phosphate, Xanthan Gum, Monocalcium Phosphate, Propylene Glycol Alginate."
569,607,Lasagna Rollups with Alfredo Sauce,"['Gluten', 'Milk', 'Soy', 'Wheat', 'Vegetarian']",/menus/item/9e25d795-02f8-4bf4-ac15-77f4aa620658,470,rollup," GF Alfredo Sauce  (Cream, Skim Milk, Water, Parmesan And Asiago Cheese Blend With Flavor  (Parmesan And Asiago Cheeses [Cultured Milk, Salt, Enzymes], Enzyme Modified Parmesan Cheese [Cultured Milk, Water, Salt, Enzymes], Whey, Salt), Soybean Oil, Canola Oil, 2% Or Less Of Modified Cornstarch, Salt, Romano Cheese Made From Cow's Milk Cultured Milk, Salt, Enzymes), Lactose, Spice, Xanthan Gum, Datem, Mono- And Diglycerides, Seasoning  (Cornstarch, Extractives Of Turmeric And Annatto, Natural Flavor), Seasoning  (Maltodextrin, Flavor, Enzyme Modified Butterfat).), Lasagna Rollup Cheese 3.5oz  (Enriched Durum Flour  (Durum Flour, Niacin, Ferrous Sulfate, Thiamin Mononitrate, Riboflavin, Folic Acid), Water, Whole Milk Ricotta Cheese  (Pasteurized Whey, Milk, Vinegar, Salt), Bread Crumbs  (Wheat Flour, Yeast, Sugar, Salt), Imported Pecorino Romano Cheese  (Sheep’s Milk, Rennet, Salt), Modified Food Starch, Black Pepper, Parsley.)"
570,608,Lasagna,"['Gluten', 'Milk', 'Soy', 'Wheat']",/menus/item/111bf101-d390-488d-ae78-75d18749d346,195,4x4cut," Lasagna  (Blanched Macaroni Product  (Water, Semolina), Tomato Puree  (Water, Tomato Paste), Water, Low Fat Ricotta Cheese  (Pasteurized Whey, Pasteurized Milk, Pasteurized Cream, Vinegar, Carrageenan, Xanthan Gum), Cooked Beef, Low Moisture Part-Skim Mozzarella Cheese  (Cultured Milk, Salt, Enzymes), Tomatoes  (Diced Tomatoes, Tomato Juice, Citric Acid, Calcium Chloride), 2% Or Less Of Dried Onions, Modified Corn Starch, Sugar, Bread Crumbs  (Bleached Wheat Flour Contains 2% Or Less Of: Sugar, Yeast, Salt), Parmesan And Asiago Cheese Blend With Flavor  (Parmesan And Asiago Cheeses [Cultured Milk, Salt, Enzymes], Flavor [Enzyme Modified Parmesan Cheese  (Cultured Milk, Water, Salt, Enzymes)], Whey, Salt), Salt, Bleached Enriched Wheat Flour  (Wheat Flour, Niacin, Reduced Iron, Thiamin Mononitrate, Riboflavin, Folic Acid), Romano Cheese  (Cultured Cow’s Milk, Salt, Enzymes), Potassium Chloride, Garlic, Dried Soy Sauce  (Soybeans, Salt, Wheat), Spices, Seasoning  (Water, Flavor, Maltodextrin, Salt, Caramel Color, Less Than 2% Of Lactic Acid, Enzyme Modified Cream), Beef Flavor  (Salt, Seasoning [Including Hydrolyzed Beef Protein], Tapioca Dextrin, Modified Cornstarch, Palm Oil, Maltodextrin, Citric Acid, Arabic Gum), Dried Garlic, Yeast Extract, Seasoning  (Soy Sauce [Water, Soybeans, Wheat, Salt], Autolyzed Yeast Extract, Dextrose, Soybean Oil), Flavors.)"
571,609,Apple French Toast Stuffed Casserole,"['Eggs', 'Gluten', 'Milk', 'Sesame', 'Soy', 'Wheat', 'Vegetarian']",/menus/item/c87f3a1a-4e34-4946-bc28-17f04b4dfb2b,202,4 x4cut," Texas Toast  (Enriched Flour [Unbleached Wheat Flour, Malted Barley Flour, Reduced Iron, Thiamine Mononitrate  (Vitamin B1), Riboflavin  (Vitamin B2), Niacin  (Vitamin B3), Folic Acid], Water, Sugar, Yeast, Soybean Oil, Salt, Wheat Gluten, Vinegar, Calcium Propionate  (A Preservative), Yellow Corn Flour, Monoglycerides, Annatto Extract And Turmeric Added For Color, Wheat Starch, Calcium Sulfate, Potassium Chloride, Sodium Stearoyl Lactylate, Calcium Phosphate, Ascorbic Acid, Sesame.), 2% Milk  (Grade A Reduced Fat Milk, Vitamin A Palmitate & Vitamin D3.), Egg Whole Frozen  (Egg  (Whole Frozen)), Apples Fuji Flame Roasted  (6 x 2.5#)  (Sliced Apples, Water, Sugar.), Cream Cheese  (Pasteurized Milk And Cream, Whey Protein Concentrate, Whey, Salt, Carob Bean Gum, Xanthan Gum, Guar Gum, Natamycin A Natural Mold Inhibitor, Vitamin A Palmitate, Cheese Culture.), Pancake Syrup  (Corn Syrup, Water, Natural And Artificial Maple Flavor, Salt, Carboxymethyl Cellulose, Sodium Benzoate And Potassium Sorbate  (As Preservatives), Caramel Color.)"
572,610,Blueberry Corn Muffin,"['Eggs', 'Gluten', 'Milk', 'Soy', 'Wheat', 'Vegetarian']",/menus/item/53e5d041-fc05-447f-ba37-82d7d608378a,177,1each," Muffin Mix Corn  (Enriched Flour Bleached  (Wheat Flour, Niacin, Iron, Thiamin Mononitrate, Riboflavin, Folic Acid), Sugar, Degermed Yellow Corn Meal, Soybean Oil, Modified Corn Starch, Yellow Corn Flour, Leavening  (Sodium Acid Pyrophosphate, Baking Soda, Monocalcium Phosphate). Contains 2% Or Less Of: Salt, Eggs With Sodium Silicoaluminate, Modified Whey, Mono And Diglycerides, Nonfat Milk, Xanthan Gum, Soy Flour.), Water  (Water), Blueberries  (Blueberries.)"
573,611,Spicy Lebanese Shrimp,"['Gluten', 'Milk', 'Shellfish', 'Soy', 'Wheat']",/menus/item/3235ec4a-ba7e-479d-b77a-717e8ba556da,388,6 ozladle," Water  (Water), Pasta Linguini  2 x 10#  (Semolina Wheat, Durum Wheat Flour, Vitamin B3 Niacin, Iron Ferrous Sulfate, Vitamin B1 Thiamine Mononitrate, Vitamin B2 Riboflavin, Folic Acid.), Tomato Diced 6 x #10  (Tomatoes, Tomato Juice, Less Than 2% Of: Salt, Calcium Chloride, Citric Acid.), Diced Onion, Salad Shrimp  (Shrimp, Water, Salt, Sodium Tripolyphosphate  (To Retain Moisture), Sodium Bisulfite  (As A Preservative).), Canola/Olive Oil Blend  (Canola Oil, Extra Virgin Olive Oil), Garlic Chopped  (Minced Garlic  (Peeled Garlic)), Lemon Juice  (Filtered Water, Lemon Juice Concentrate, Sodium Bisulfite  (Preservative), Sodium Benzoate  (Preservative), Lemon Oil), Water  (Water), Cilantro  (Cilantro), Iodized Salt  (Salt, Sodium Silicoaluminate, Dextrose, Potassium Iodine), Iodized Salt  (Salt, Sodium Silicoaluminate, Dextrose, Potassium Iodine), Crushed Red Pepper  (Crushed Red Pepper), Canola/Olive Oil Blend  (Canola Oil, Extra Virgin Olive Oil), Spice Pepper Black Ground 18 oz  (Black Pepper), Canola/Olive Oil Blend  (Canola Oil, Extra Virgin Olive Oil), Spice Coriander Ground 16 oz  (Coriander), Base Chicken No MSG  (Chicken Meat Including Natural Chicken Juices, Salt, Sugar, Chicken Fat, Hydrolyzed Wheat, Corn, And Soy Proteins, Whey, Maltodextrin, 2% Or Less Of Onion Powder, Hydrogenated Cottonseed Oil, Disodium Inosinate And Disodium Guanylate, Corn Oil, Autolyzed Yeast Extract, Natural Extractives Of Turmeric And Annatto, Natural Flavors, Dextrose, Lactic Acid.)"
574,612,Indian Mango Chutney,"['Gluten', 'Vegan', 'Vegetarian']",/menus/item/0776f82c-ce05-45f6-a09d-3ea9a7e087b4,18,1tablespoon," Mango Cubes  (Mango.), Granulated Sugar  (Sugar.), Diced Onion, Malt Vinegar  (Malt Vinegar Barley, Corn Malt, Diluted With Water To 5 Acidity.), Lemon Zest  (Lemon  (Lemons Fresh)), Ginger Root 30# Case  (Ginger Root.), Minced Garlic  (Peeled Garlic), Spice Cumin Whole 1#  (Ground Cumin), Spice Cloves Whole, Crushed Red Pepper  (Crushed Red Pepper), Coarse Kosher Salt  (Salt, Yellow Prussiate Of Soda), Black Peppercorns  (Black Pepper)"
575,613,Carrot Nut Cake,"['Eggs', 'Gluten', 'Milk', 'Soy', 'Tree Nuts', 'Wheat', 'Vegetarian']",/menus/item/60b7b6f3-1091-4fda-b481-53a87a984bfb,370,8x10 cut," Granulated Sugar  (Sugar.), Powdered Sugar  (Sugar, Carnauba Wax), Carrots Bulk Jumbo 50#  (Carrots), Canola Oil  (Canola Oil With TBHQ And Citric Acid Added To Help Protect Flavor. Dimethylpolysiloxane, An Antifoaming Agent, Added.), Flour All Purpose H&R Gold Medal  (Bleached Wheat Flour, Malted Barley Flour, Niacin, Iron, Thiamin Mononitrate, Riboflavin, Folic Acid.), Cream Cheese  (Pasteurized Milk And Cream, Whey Protein Concentrate, Whey, Salt, Carob Bean Gum, Xanthan Gum, Guar Gum, Natamycin A Natural Mold Inhibitor, Vitamin A Palmitate, Cheese Culture.), Egg Whole Frozen  (Egg  (Whole Frozen)), Margarine  (Vegetable Oil Blend  (Palm Oil And Soybean Oil), Water, Salt, Contains Less Than 2% Of Soy Lecithin, Vegetable Mono Diglycerides, Potassium Sorbate  (A Preservative), Citric Acid, Natural Artificial Flavor, Beta Carotene  (Color), Vitamin A Palmitate Added, Whey.), Walnut Pieces, Baking Soda 24 x 1#  (Sodium Bicarbonate), Iodized Salt  (Salt, Sodium Silicoaluminate, Dextrose, Potassium Iodine), Flavor Vanilla Imitation  (Water, Caramel Color, Artifical Flavor, Citric Acid, Sodium Benzoate  (Preservative).), Flavor Vanilla Imitation  (Water, Caramel Color, Artifical Flavor, Citric Acid, Sodium Benzoate  (Preservative).), Ground Cinnamon"
