,Unnamed: 0,name,tags,url,calories,serving_size,ingredients
189,197,Pasta Shrimp Fettuccine Alfredo,"['Gluten', 'Milk', 'Shellfish', 'Soy', 'Wheat', 'Vegetarian']",/menus/item/1ea9347e-d9d0-4608-920d-c6b26f910715,283,1cup," Water  (Water), Pasta Fettuccine 20#  (Semolina Wheat, Durum Wheat Flour, Vitamin B3 Niacin, Iron Ferrous Sulfate, Vitamin B1 Thiamine Mononitrate, Vitamin B2 Riboflavin, Folic Acid), GF Alfredo Sauce  (Cream, Skim Milk, Water, Parmesan And Asiago Cheese Blend With Flavor  (Parmesan And Asiago Cheeses [Cultured Milk, Salt, Enzymes], Enzyme Modified Parmesan Cheese [Cultured Milk, Water, Salt, Enzymes], Whey, Salt), Soybean Oil, Canola Oil, 2% Or Less Of Modified Cornstarch, Salt, Romano Cheese Made From Cow's Milk Cultured Milk, Salt, Enzymes), Lactose, Spice, Xanthan Gum, Datem, Mono- And Diglycerides, Seasoning  (Cornstarch, Extractives Of Turmeric And Annatto, Natural Flavor), Seasoning  (Maltodextrin, Flavor, Enzyme Modified Butterfat).), Salad Shrimp  (Shrimp, Water, Salt, Sodium Tripolyphosphate  (To Retain Moisture), Sodium Bisulfite  (As A Preservative).), Shredded Parmesan Cheese  (Shredded Parmigiano  (Pasteurized Part-Skim Cow’s Milk, Cheese Cultures, Salt, Enzymes).), Iodized Salt  (Salt, Sodium Silicoaluminate, Dextrose, Potassium Iodine)"
190,198,Fried Cheese Ravioli,"['Eggs', 'Gluten', 'Milk', 'Soy', 'Wheat', 'Vegetarian']",/menus/item/ad81509c-7974-4aac-b273-0a821b2f536a,484,8per," Pasta Ravioli Breaded Cheese 2/5#  (Ravioli: Enriched Durum Flour  (Wheat Flour, Niacin, Iron, Thiamin Mononitrate, Riboflavin, Folic Acid), Water, Cheese Sauce  (Water, Soybean Oil, Granular, Jack And Semi-Soft Cheese [Pasteurized Milk, Cheese Cultures, Salt, Enzymes], Whey, Modified Food Starch, Salt, Nonfat Dry Milk, Methylcellulose [Modified Vegetable Gum], Sodium Phosphate, Mono And Diglycerides, Citric Acid), Ricotta Cheese  (Pasteurized Whey, Pasteurized Milk, Vinegar, Stabilizer [Modified Food Starch, Guar Gum, Carrageenan], Salt), Mozzarella Cheese  (Pasteurized Milk, Cheese Cultures, Salt, Enzymes), Asiago Cheese  (Pasteurized Milk, Cheese Cultures, Salt, Enzymes), Eggs, Contains Less Than 2% Of: Parmesan Cheese  (Pasteurized Part-Skim Milk, Cheese Cultures, Salt, Enzymes), Garlic Puree  (Garlic, High Fructose Corn Syrup), Garlic, Modified Food Starch, Salt. Breaded With: Bleached Wheat Flour, Water, Contains Less Than 2% Of: Cheddar Cheese  (Pasteurized Milk, Cheese Cultures, Salt, Enzymes, Annatto), Whey  (Milk), Buttermilk Solids, Modified Corn Starch, Yellow Corn Flour, Dehydrated Potato  (Potatoes, Mono And Diglycerides), Spices, Green Onion, Garlic Powder, Sugar, Yeast, Parsley, Dextrose, Lactic Acid, Yellow #5, Yellow #6, Salt. Prefried In Vegetable Oil  (Soybean And/Or Canola).)"
191,199,Roasted Cajun Fingerling Potatoes,"['Vegan', 'Vegetarian']",/menus/item/52cf70f1-c94c-4060-81f7-11a498de39cc,248,4oz.," Potato Fingerling, Canola/Olive Oil Blend  (Canola Oil, Extra Virgin Olive Oil), Coarse Kosher Salt  (Salt, Yellow Prussiate Of Soda), Seasoning Cajun 22 oz.  (Dehydrated Garlic, Spices, Salt, Paprika  (Color), Dehydrated Onion, Red Pepper.)"
192,200,Roasted Asiago Broccoli,"['Milk', 'Vegetarian']",/menus/item/7a7d62a2-8b24-4219-8108-ab7b2514743c,128,4oz," Broccoli Florets  (Broccoli Florettes.), Canola/Olive Oil Blend  (Canola Oil, Extra Virgin Olive Oil), Cheese Asiago Shredded  (Asiago Cheese  (Pasteurized Milk, Cheese Cultures, Salt, Enzymes), Powdered Cellulose  (To Prevent Caking).), Minced Garlic  (Peeled Garlic), Iodized Salt  (Salt, Sodium Silicoaluminate, Dextrose, Potassium Iodine), Spice Pepper Black Ground 18 oz  (Black Pepper), Herb Thyme 1#  (Thyme), Herb Rosemary 4 oz."
193,201,Buffalo Chicken Dip,"['Eggs', 'Milk', 'Soy']",/menus/item/08f9ff1f-3894-4a9a-8adb-36d2894c46df,115,1/4cup," Chicken Pulled 2 x 5#  (Dark Chicken Meat, Water, Tomatoes  (Water, Tomato Paste), Seasoning  (Salt, Sugar, Spices, Dehydrated Garlic, Xanthan Gum, Mustard, Dehydrated Onion, Corn Syrup Solids, Paprika, Canola Oil, Chili Pepper, Lemon Juice Solids, Natural Flavors, Garlic Powder), Chicken Fat, Sodium Phosphates, Rice Flour, Chicken Type Flavor  (Autolyzed Yeast Extract, Flavors, Salt, Chicken Fat), Chili Powder  (Chili Peppers, Flavoring), Curry Powder  (Spices, Turmeric).), Cream Cheese  (Pasteurized Milk And Cream, Whey Protein Concentrate, Whey, Salt, Carob Bean Gum, Xanthan Gum, Guar Gum, Natamycin A Natural Mold Inhibitor, Vitamin A Palmitate, Cheese Culture.), Frank's Red Hot Buffalo Sauce  (Distilled Vinegar, Aged Cayenne Red Peppers, Salt, Water, Canola Oil, Paprika, Xanthan Gum, Natural Butter Type Flavor, And Garlic Powder.), Ranch Dressing  (Soybean Oil, Water, Vinegar, Buttermilk, Sugar, Egg Yolk Salt, Contains Less Than 2% Of The Following: Modified Food Starch, Dried Whey, Xanthan Gum, Dried Garlic, Died Onions, Spice, Phosphoric Acid, Disodium Guanylate, Disodium Inosinate, Sorbic Acid And Calcium Disodium EDTA  (To Protect Flavor)..), Shredded Cheddar Cheese  (Pasteurized Milk, Cheese Culture, Salt, Enzymes, And Annatto  (Color) When Applicable.), Spice Buffalo Burger Rub  (Blended Of Salt, Spices, Sodium Phosphates  (15.79%), Sugar, Modified Food Starch, Vinegar, Powder Garlic, Onion Powder, Spice Extractives.)"
194,203,White Mini Sub Bun,"['Gluten', 'Sesame', 'Soy', 'Wheat', 'Vegan', 'Vegetarian']",/menus/item/030ac99f-1d7a-4e2e-8a88-50941a828db6,169,1bun," Enriched Flour  (Unbleached Wheat Flour, Malted Barley Flour, Reduced Iron, Thiamine Mononitrate  (Vitamin B1), Riboflavin  (Vitamin B2), Niacin  (Vitamin B3), Folic Acid), Water, Yeast, Sugar, Soybean Oil, Salt, Wheat Gluten, Calcium Propionate  (A Preservative), Vinegar, Monoglycerides, Potassium Chloride, Calcium Phosphate, Ascorbic Acid, Sesame."
195,204,Grated Parmesan Cheese,"['Milk', 'Vegetarian']",/menus/item/5c7d5c81-f792-4c46-8934-e3e09d731c6c,113,1ounce," Grated Parmesan  (Pasteurized Cow’s Milk, Salt, Enzymes), Powdered Cellulose Added To Prevent Caking."
196,205,Cajun Chicken Drumsticks,[],/menus/item/85ecf9b6-b9f1-4be1-af49-b86b73dd5122,179,1leg," Chicken Drumstick, Canola Oil  (Canola Oil With TBHQ And Citric Acid Added To Help Protect Flavor. Dimethylpolysiloxane, An Antifoaming Agent, Added.), Spice Cajun/Andouille Rub  (Salt, Spices, Onion Powder, Garlic Powder, Extractives Of Spice And Paprika.)"
197,206,Zesty Mediterranean Couscous,"['Gluten', 'Milk', 'Soy', 'Wheat']",/menus/item/78828019-8d95-4794-9d90-c0420c6b0080,214,1cup," Water  (Water), Red Pepper  (Red Pepper), Couscous Israeli  (Wheat Flour.), Sliced Fresh Mushrooms  (Raw Mushrooms.), Cheese Mozzarella Log 8 x 1#  (Pasteurized Milk, Vinegar, Enzymes, Salt.), Tomato Sundried 5#  (Sun-Dried Tomatoes, Salt. Contains 2% Or Less
Glucose Syrup, Citric Acid, Sulfur Dioxide  (For
Color Retention), Potassium Sorbate.), Olive Oil  (Extra Virgin Olive Oil.), Lemon Juice  (Filtered Water, Lemon Juice Concentrate, Sodium Bisulfite  (Preservative), Sodium Benzoate  (Preservative), Lemon Oil), Fresh Basil  (Fresh Basil), Honey  (Honey), Base Chicken No MSG  (Chicken Meat Including Natural Chicken Juices, Salt, Sugar, Chicken Fat, Hydrolyzed Wheat, Corn, And Soy Proteins, Whey, Maltodextrin, 2% Or Less Of Onion Powder, Hydrogenated Cottonseed Oil, Disodium Inosinate And Disodium Guanylate, Corn Oil, Autolyzed Yeast Extract, Natural Extractives Of Turmeric And Annatto, Natural Flavors, Dextrose, Lactic Acid.), Whole Grain Dijon Mustard  (Water, Mustard Seeds, Vinegar, Salt.), Iodized Salt  (Salt, Sodium Silicoaluminate, Dextrose, Potassium Iodine), Spice Pepper Black Ground 18 oz  (Black Pepper)"
198,207,Baked Cheese Grits,"['Eggs', 'Milk', 'Soy', 'Vegetarian']",/menus/item/f5393493-fb40-43d3-a96d-1713821358ca,194,1/2cup," Water  (Water), Grits Quick 24 oz.  (Degerminated White Corn Grits, Niacinamide, Reduced Iron, Thiamin Mononitrate, Riboflavin, Folic Acid.), Shredded Cheddar Cheese  (Pasteurized Milk, Cheese Culture, Salt, Enzymes, And Annatto  (Color) When Applicable.), Egg Whole Frozen  (Egg  (Whole Frozen)), Margarine  (Vegetable Oil Blend  (Palm Oil And Soybean Oil), Water, Salt, Contains Less Than 2% Of Soy Lecithin, Vegetable Mono Diglycerides, Potassium Sorbate  (A Preservative), Citric Acid, Natural Artificial Flavor, Beta Carotene  (Color), Vitamin A Palmitate Added, Whey.), Garlic Powder  (Garlic Powder.), Iodized Salt  (Salt, Sodium Silicoaluminate, Dextrose, Potassium Iodine)"
199,208,Broccoli Spears,"['Vegan', 'Vegetarian']",/menus/item/55d2d70b-33fd-4601-827c-1075a37ad5fb,12,1spear, Broccoli Spears Frozen  (Broccoli Florettes.)
200,209,Beef Lo Mein,"['Gluten', 'Soy', 'Wheat']",/menus/item/9049fdf7-84fe-4e72-ab16-b50ba55566b4,351,1cup," Water  (Water), Pasta Spaghetti 20#  (Semolina Wheat, Durum Wheat Flour, Vitamin B3 Niacin, Iron Ferrous Sulfate, Vitamin B1 Thiamine Mononitrate, Vitamin B2 Riboflavin, Folic Acid), Beef Strip 2"" x 1/2"" x 1/4""  (90% Or Better Extra Lean Cuts Of Beef), Green Cabbage  (Green Cabbage), Yellow Onion, Celery, Carrots Bulk Jumbo 50#  (Carrots), Sauce Soy Tamari GF  (Water, Soybeans, Salt, Alcohol  (To Preserve Freshness).), Canola Oil  (Canola Oil With TBHQ And Citric Acid Added To Help Protect Flavor. Dimethylpolysiloxane, An Antifoaming Agent, Added.), Iodized Salt  (Salt, Sodium Silicoaluminate, Dextrose, Potassium Iodine), Granulated Sugar  (Sugar.), Canola Oil  (Canola Oil With TBHQ And Citric Acid Added To Help Protect Flavor. Dimethylpolysiloxane, An Antifoaming Agent, Added.), Minced Garlic  (Peeled Garlic), Iodized Salt  (Salt, Sodium Silicoaluminate, Dextrose, Potassium Iodine), Sauce Soy Mushroom 12 x 5#  (Water, Soybeans, Sugar, Salt, Wheat Flour, Extract Of Mushroom, Sulfur Dioxide.), Spice Pepper Black Ground 18 oz  (Black Pepper)"
201,210,Chocolate Candy Piece Cookie,"['Eggs', 'Gluten', 'Milk', 'Soy', 'Wheat', 'Vegetarian']",/menus/item/08b0e608-89e7-475a-b206-384a66025b92,121,1cookie," Dough Cookie Carnival 1 oz  (Enriched Bleached Flour  (Bleached Wheat Flour, Malted Barley Flour, Niacin, Iron, Thiamine Mononitrate, Riboflavin, Folic Acid), Sugar, Margarine  (Palm Oil, Water, Soybean Oil, Contains 2% Or Less Of: Salt, Mono- And Diglycerides, Natural Flavors [Contains Milk], Citric Acid, Vitamin A Palmitate Added, Beta Carotene [Color]), Semi-Sweet Chocolate Chips  (Sugar, Unsweetened Chocolate, Cocoa Butter, Dextrose, Soy Lecithin, Natural Flavor, Milk), Colored Chocolate Candies  (Semi-Sweet Chocolate [Sugar, Unsweetened Chocolate, Cocoa Butter, Dextrose, Soy Lecithin, Natural Flavor], Sugar, Coloring [Titanium Dioxide, Red 40 Lake, Yellow 6 Lake, Yellow 6, Yellow 5 Lake, Blue 1 Lake, Red 3, Blue 2 Lake], Corn Starch, Confectioner's Glaze [Carnauba Wax, Beeswax, Shellac]), Eggs, Dextrose, Contains 2% Or Less Of: Water, Molasses, Baking Soda, Salt, Pregelatinized Wheat Starch, Natural And Artificial Flavor.)"
202,211,Vanilla Pudding,"['Milk', 'Vegetarian']",/menus/item/19211511-2a88-490c-8d1f-f9391338b67d,259,1cup," 2% Milk  (Grade A Reduced Fat Milk, Vitamin A Palmitate & Vitamin D3.), Vanilla Pudding  (Dextrose, Sugar, Modified Food Starch, Less Than 2% Of Disodium Phosphate, Tetrasodium Pyrophosphate, Tricalcium Phosphate, Natural And Artificial Flavor, Salt, Xanthan Gum, Nonfat Dry Milk, Mono And Diglycerides, Yellow 5, Yellow 6.)"
203,212,Red Velvet Brownie,"['Eggs', 'Gluten', 'Milk', 'Wheat', 'Vegetarian']",/menus/item/252a2092-bc2f-478b-8958-04b943915bac,271,8x10cut," Brown Sugar  (Sugar, Cane Molasses), Flour All Purpose H&R Gold Medal  (Bleached Wheat Flour, Malted Barley Flour, Niacin, Iron, Thiamin Mononitrate, Riboflavin, Folic Acid.), Granulated Sugar  (Sugar.), Butter Solids  (Pasteurized Cream, Salt), Egg Whole Frozen  (Egg  (Whole Frozen)), Cocoa Powder  (Cocoa Processed With Alkali.), Food Color Liquid Red Pint  (Water, Propylene Glycol, Red 40, Red 3, And Propylparaben  (Preservative).), Flavor Vanilla Imitation  (Water, Caramel Color, Artifical Flavor, Citric Acid, Sodium Benzoate  (Preservative).), Iodized Salt  (Salt, Sodium Silicoaluminate, Dextrose, Potassium Iodine), Powdered Sugar  (Sugar, Carnauba Wax)"
204,213,Orange Wedges,"['Vegan', 'Vegetarian']",/menus/item/be8a481f-41d4-47ed-8fa6-00d1678a4b3c,10,1wedge, Orange
205,214,Tropical Blend Fruit,"['Vegan', 'Vegetarian']",/menus/item/ff4bb0ba-7b58-433e-8886-a0de30572822,99,1/2cup," Pineapple, Papaya  (Red And Yellow), Water, Guava, Sugar, Passion Fruit Juice And Citric Acid."
206,215,Alicante Style Chicken,[],/menus/item/6cbda7f9-23a8-47fa-9106-6a8ec4064509,657,1serving," Chicken Breast Split Fresh 7 oz 44# Avg  (Chicken), Canola Oil  (Canola Oil With TBHQ And Citric Acid Added To Help Protect Flavor. Dimethylpolysiloxane, An Antifoaming Agent, Added.), Minced Garlic  (Peeled Garlic), Parsley  (Parsley), Coarse Kosher Salt  (Salt, Yellow Prussiate Of Soda), Spice Pepper Black Ground 18 oz  (Black Pepper)"
207,216,Vegan Barbecue,"['Vegan', 'Vegetarian']",/menus/item/14140257-3dd3-46d9-aa29-b34d8732051f,196,#8disher," Beef Sub Crumble Meatless GF  (Water, Pea Protein, Expeller-Pressed Canola Oil, Rice Flour, Natural Flavors, Molasses  (For Color).), Ketchup  (Tomato Concentrate, High Fructose Corn Syrup, Distilled Vinegar, Corn Syrup, Salt, Less Than 2% Of: Spice, Onion Powder, Natural Flavors.), Water  (Water), Yellow Onion, Vinegar Apple Cider  (Made From The Juices Of Apples, Diluted With Water To A Uniform Pickling And Table Strength Of 5%  (50 Grains) Acidity.), Brown Sugar  (Sugar, Cane Molasses), Canola Oil  (Canola Oil With TBHQ And Citric Acid Added To Help Protect Flavor. Dimethylpolysiloxane, An Antifoaming Agent, Added.), Granulated Sugar  (Sugar.), Water  (Water), Gel Clear Instant Corn Starch 50#  (Corn Starch.), Iodized Salt  (Salt, Sodium Silicoaluminate, Dextrose, Potassium Iodine), Spice Mustard Ground, Sauce Tabasco 12 x 12 oz.  (Distilled Vinegar, Red Pepper, Salt.), Spice Pepper Black Ground 18 oz  (Black Pepper)"
208,217,Chicken Gravy,"['Gluten', 'Milk', 'Soy', 'Wheat']",/menus/item/682781d5-69ef-4b24-a25f-2578135e1550,62,2 ozladle," Water  (Water), Margarine  (Vegetable Oil Blend  (Palm Oil And Soybean Oil), Water, Salt, Contains Less Than 2% Of Soy Lecithin, Vegetable Mono Diglycerides, Potassium Sorbate  (A Preservative), Citric Acid, Natural Artificial Flavor, Beta Carotene  (Color), Vitamin A Palmitate Added, Whey.), Flour All Purpose H&R Gold Medal  (Bleached Wheat Flour, Malted Barley Flour, Niacin, Iron, Thiamin Mononitrate, Riboflavin, Folic Acid.), Base Chicken No MSG  (Chicken Meat Including Natural Chicken Juices, Salt, Sugar, Chicken Fat, Hydrolyzed Wheat, Corn, And Soy Proteins, Whey, Maltodextrin, 2% Or Less Of Onion Powder, Hydrogenated Cottonseed Oil, Disodium Inosinate And Disodium Guanylate, Corn Oil, Autolyzed Yeast Extract, Natural Extractives Of Turmeric And Annatto, Natural Flavors, Dextrose, Lactic Acid.), Ground White Pepper"
209,218,Bratwurst,['Gluten'],/menus/item/1c385fc5-1500-4d49-9f71-8d59f07f30d0,319,1 each," Sausage Bratwurst Ckd 5/# Johnsonville  (Pork, Water, Corn Syrup, Less Than 2% Of The Following: Salt, Modified Food Starch, Oat Fiber, Sodium Lactate, Dextrose, Sodium Phosphate, Flavorings, Sodium Acetate, BHA, Propyl Gallate, Citric Acid, Beef Collagen Casing.)"
210,219,Brat Bun,"['Gluten', 'Sesame', 'Soy', 'Wheat', 'Vegan', 'Vegetarian']",/menus/item/97d4456d-92a6-47fd-b3ba-a612c5f10b17,170,1bun," Enriched Flour [Unbleached Wheat Flour, Malted Barley Flour, Reduced Iron, Thiamine Mononitrate  (Vitamin B1), Riboflavin  (Vitamin B2), Niacin  (Vitamin B3), Folic Acid], Water, Sugar, Yeast, Soybean Oil, Wheat Gluten, Salt, Vinegar, Calcium Propionate  (A Preservative), Monoglycerides, Wheat Starch, Yellow Corn Flour, Annatto Extract And Turmeric Added For Color, Calcium Phosphate, Ascorbic Acid, Sesame."
211,220,Honey BBQ Wing Sauce,['Vegetarian'],/menus/item/ab29e36b-3087-4375-8f68-ee0b71246798,157,1/4cup," Ken's Cannonball BBQ Sauce  (Sugar, Distilled Vinegar, Water, Tomato Paste, Molasses, Modified Potato Starch, Salt, Contains Less Than 2% Of Natural Smoke Flavor, Mustard Flour, Spice, Paprika, Onion, Garlic, Caramel Color, Maltodextrin, Chili Powder  (Chili Pepper, Spice, Salt, Garlic), Autolyzed Yeast Extract, Natural Flavor.), Honey  (Honey)"
212,221,Red Curry Chicken with Potatoes,"['Coconut', 'Fish', 'Shellfish']",/menus/item/0feae0ae-6e15-4d8b-8eb3-3c94bb9d21ed,249,3/4cup," Chicken Breast Diced Raw 1/2""  (Chicken.), Water  (Water), Milk Coconut 6 x #10  (Coconut Milk, Water, Polysorbate 60, Guar Gum, Sodium Carboxyl Methyl Cellulose, Sodium Metabisulfite  (Preservative).), Potato Peeled Diced 1/2""  (Potatoes, Dextrose, Disodium Dihydrogen Pyrophosphate  (To Maintain Natural Color)), Milk Coconut 6 x #10  (Coconut Milk, Water, Polysorbate 60, Guar Gum, Sodium Carboxyl Methyl Cellulose, Sodium Metabisulfite  (Preservative).), Yellow Onion, Paste Curry Red 35 oz  (Garlic, Dried Red Chili, Lemongrass, Shallot, Salt, Galangal, Shrimp Paste  (Shrimp, Salt), Kaffir Lime Peel, Pepper), Fish Sauce  (Anchovy Extract  (Fish), Salt, Water, Sugar, Hydrolyzed Vegetable Protein  (Corn).), Brown Sugar  (Sugar, Cane Molasses), Spice Curry Powder 16 oz.  (Spices, Turmeric  (As Color), Salt, Red Pepper, Spice Extract)"
213,222,Sugar Cookie,"['Eggs', 'Gluten', 'Milk', 'Soy', 'Wheat', 'Vegetarian']",/menus/item/e6f64b96-5602-4649-a2ac-6ee0165afd4f,120,1cookie," Dough Cookie Sugar 1oz  (Enriched Bleached Flour  (Bleached Wheat Flour, Malted Barley Flour, Niacin, Iron, Thiamine Mononitrate, Riboflavin, Folic Acid), Sugar, Margarine  (Palm Oil, Water, Soybean Oil, Contains 2 Or Less Of: Salt, Mono- And Diglycerides, Natural Flavors [Contains Milk], Citric Acid, Vitamin A Palmitate Added, Beta Carotene [Color]), Eggs, Contains 2 Or Less Of: Invert Sugar, Salt, Baking Soda, Defatted Soy Flour.)"
214,223,Strawberry Butter Cream Frosting,"['Milk', 'Soy', 'Vegetarian']",/menus/item/fc2eaae8-09b5-4699-850d-ba5119808bb8,74,1tablespoon," Powdered Sugar  (Sugar, Carnauba Wax), Margarine  (Vegetable Oil Blend  (Palm Oil And Soybean Oil), Water, Salt, Contains Less Than 2% Of Soy Lecithin, Vegetable Mono Diglycerides, Potassium Sorbate  (A Preservative), Citric Acid, Natural Artificial Flavor, Beta Carotene  (Color), Vitamin A Palmitate Added, Whey.), Sliced Strawberries  (Strawberries, Sugar.), 2% Milk  (Grade A Reduced Fat Milk, Vitamin A Palmitate & Vitamin D3.), Flavor Vanilla Imitation  (Water, Caramel Color, Artifical Flavor, Citric Acid, Sodium Benzoate  (Preservative).), Coarse Kosher Salt  (Salt, Yellow Prussiate Of Soda)"
215,224,Chocolate Layer Cake,"['Eggs', 'Gluten', 'Milk', 'Soy', 'Wheat', 'Vegetarian']",/menus/item/ddd953ba-15bb-44d1-962f-30be0dea56c5,313,cut16," Sugar, Water, Enriched Flour  (Bleached Wheat Flour, Wheat Flour, Niacin, Reduced Iron,Thiamine Mononitrate, Riboflavin, Folic Acid), Vegetable Oil  (Soybean, Palm), Eggs, Cocoa Processed With Alkali, High Fructose Corn Syrup, Corn Syrup, Shortening [Palm Oil And Soybean Oil, Citric Acid  (Preservative)], Contains 2% Or Less: Skim Milk, Caramel Color, Corn Starch, Salt, Modified Corn Starch, Mono- And Diglycerides, Leavening  (Sodium Aluminum Phosphate, Baking Soda, Monocalcium Phosphate), Sodium Alginate, Wheat Starch, Natural And Artificial Flavors, Polysorbate 60, Gellan Gum, Soy Lecithin, Lactylic Esters Of Fatty Acids."
216,225,Lemon Crunch Pie,"['Eggs', 'Gluten', 'Milk', 'Soy', 'Wheat', 'Vegetarian']",/menus/item/faa05f02-8a46-4323-b07c-cb90ffdc03b8,371,10cut," Pie Lemon Crunch Unbaked 10"" CP  (Water, Enriched Flour  (Wheat Flour, Niacin, Reduced Iron, Thiamine Mononitrate, Riboflavin, Folic Acid), Sugar, Corn Syrup, Vegetable Oil  (Palm, Soybean), Eggs, Modified Corn Starch, Contains 2% Or Less: Lemon Juice Concentrate, White Grape Juice Concentrate, Salt, Butter  (Cream, Salt), Lemon Juice Solids, Natural Flavors, Cellulose Gel, Lemon Oil, Wheat Gluten, Mono- And Diglycerides, Colored With  (Annatto Extract, Turmeric).)"
217,226,Applesauce,"['Vegan', 'Vegetarian']",/menus/item/78c71078-ecb0-423f-a221-b344b4e3be4f,96,1/2cup," Apples, Sugar, Water, Ascorbic Acid Added To Maintain Color."
218,227,Cheeseburger Casserole,"['Eggs', 'Gluten', 'Milk', 'Soy', 'Wheat']",/menus/item/1a046607-2fc1-4052-94a0-ba7b0deba29d,351,1/2cup," Beef Ground 80 Fine Grind Chuck 60# Avg, Water  (Water), Soup Cream Of Mushroom  (Water, Vegetable Oil  (Corn, Canola, And/Or Soybean), Mushrooms, Modified Food Starch, Wheat Flour, Contains Less Than 2% Of: Salt, Cream  (Milk), Soy Protein Concentrate, Yeast Extract, Dried Whey, Dried Garlic, Flavoring.), Pasta Noodle Egg 1/4"" 10#  (Durum Wheat Semolina, Durum Wheat Flour, Eggs, Niacin, Iron  (Ferrous Sulfate), Thiamin Mononitrate, Riboflavin, Folic Acid.), 2% Milk  (Grade A Reduced Fat Milk, Vitamin A Palmitate & Vitamin D3.), Shredded American Cheese  (American Cheese Milk, Cheese Cultures, Salt, Enzymes, Water, Cream, Sodium Phosphate, Color Added, Salt, Lactic Acid, Sorbic Acid Preservative, Corn Starch, Anti-Caking Agent, Natamycin A Mold Inhibitor.), Shredded American Cheese  (American Cheese Milk, Cheese Cultures, Salt, Enzymes, Water, Cream, Sodium Phosphate, Color Added, Salt, Lactic Acid, Sorbic Acid Preservative, Corn Starch, Anti-Caking Agent, Natamycin A Mold Inhibitor.), Yellow Onion, Iodized Salt  (Salt, Sodium Silicoaluminate, Dextrose, Potassium Iodine), Herb Parsley 60 Ct.  (Parsley), Iodized Salt  (Salt, Sodium Silicoaluminate, Dextrose, Potassium Iodine), Ground White Pepper"
219,228,Rotini,"['Gluten', 'Wheat', 'Vegan', 'Vegetarian']",/menus/item/4ea98f5f-85aa-40f1-a763-30b2ee91c2ae,213,1cup," Water  (Water), Rotini Pasta  (Semolina Wheat, Durum Wheat Flour, Vitamin B3 Niacin, Iron Ferrous Sulfate, Vitamin B1 Thiamin Mononitrate, Vitamin B2 Riboflavin, Folic Acid), Iodized Salt  (Salt, Sodium Silicoaluminate, Dextrose, Potassium Iodine), Canola Oil  (Canola Oil With TBHQ And Citric Acid Added To Help Protect Flavor. Dimethylpolysiloxane, An Antifoaming Agent, Added.)"
220,229,Cheddar Cheese Sauce,"['Gluten', 'Milk', 'Wheat', 'Vegetarian']",/menus/item/3b2ece1b-3db4-41f7-9265-4645c52638fe,158,1/2cup," 2% Milk  (Grade A Reduced Fat Milk, Vitamin A Palmitate & Vitamin D3.), Cheese Velveeta Shredded 4 x 5#  (Cheddar And Colby Cheeses  (Milk, Cheese Culture, Salt, Enzymes, Annatto [Color]), Water, Whey Protein Concentrate, Skim Milk, Whey, Sodium Citrate, Milkfat, Salt, Sodium Phosphate, Sorbic Acid As A Preservative, Apocarotenal  (Color), With Cellulose Powder Added To Prevent Caking), Cheese Cheddar White Sharp, Base Culinary Cream  (Water, Butter  (Cream, Lactic Acid), Lactose, 2% Or Less Of Sodium Caseinate, Xanthan Gum, Whey Protein Concentrate, Salt, Guar Gum, Potassium Sorbate  (A Preservative), Citric Acid.), Butter Solids  (Pasteurized Cream, Salt), Flour All Purpose H&R Gold Medal  (Bleached Wheat Flour, Malted Barley Flour, Niacin, Iron, Thiamin Mononitrate, Riboflavin, Folic Acid.), Coarse Kosher Salt  (Salt, Yellow Prussiate Of Soda), Spice Mustard Ground, Cayenne Pepper  (Red Pepper)"
221,230,Flame Roasted Sweet Potatoes,"['Milk', 'Vegetarian']",/menus/item/63efc38b-8221-4d6d-aee0-883facf34a63,99,1/2cup," Potato Sweet Roasted w Maple Seasoning  (Sweet Potatoes, Brown Sugar, Olive Oil, Sugar, Contains Less Than 2% Of Maple Sugar, Natural Flavor, Salt, Spices, Xanthan Gum.), Butter Solids  (Pasteurized Cream, Salt)"
222,231,Roasted Brussels Sprouts,"['Vegan', 'Vegetarian']",/menus/item/140ab3cc-84bb-481b-8de1-89c4f0e3aa0b,110,4oz," Brussels Sprouts Shaved Fresh 2#  (Brussel Sprouts.), Canola Oil  (Canola Oil With TBHQ And Citric Acid Added To Help Protect Flavor. Dimethylpolysiloxane, An Antifoaming Agent, Added.), Lemon Juice  (Filtered Water, Lemon Juice Concentrate, Sodium Bisulfite  (Preservative), Sodium Benzoate  (Preservative), Lemon Oil), Minced Garlic  (Peeled Garlic), Coarse Kosher Salt  (Salt, Yellow Prussiate Of Soda), Crushed Red Pepper  (Crushed Red Pepper)"
223,232,Garlic Breadstick,"['Gluten', 'Milk', 'Soy', 'Wheat', 'Vegetarian']",/menus/item/eff30997-9597-460b-940c-5ae15b99300e,153,1each," Breadstick Gourmet Parbaked Turano  (Flour  (Wheat Flour, Malted Barley), Water, Contains Less Than 2% Of Each Of The Following: Salt, Dextrose, Palm Oil, Wheat Gluten, Wheat Starch, Diacetyl Tartaric Acid Esters Of Mono-Diglycerides  (Datem), L-Cysteine, Ascorbic Acid, Enzyme, Yeast, Mono- And Diglycerides, Ethoxylated Mono And Diglycerides, Polysorbate 60, Calcium Propionate  (Preservative), Enriched Wheat Flour  (Wheat Flour, Niacin, Reduced Iron, Thiamine Mononitrate, Riboflavin, Folic Acid). Topping: Water, Potassium Sorbate.), Garlic Butter Spread  (Margarine  (Vegetable Oil Blend  (Palm Oil And Soybean Oil), Water, Salt, Contains Less Than 2% Of Soy Lecithin, Vegetable Mono Diglycerides, Potassium Sorbate  (A Preservative), Citric Acid, Natural Artificial Flavor, Beta Carotene  (Color), Vitamin A Palmitate Added, Whey.), Garlic Seasoning  (Garlic Powder.), Coarse Kosher Salt  (Salt, Yellow Prussiate Of Soda), Sweet Basil, Spice Pepper Black Ground 18 oz  (Black Pepper), Oregano  (Oregano), Spice Parsley Flakes)"
