,Unnamed: 0,name,tags,url,calories,serving_size,ingredients
0,0,Scrambled Eggs,"['Eggs', 'Milk', 'Vegetarian']",/menus/item/6c883ba0-e283-4086-ab01-e181a6615435,160,1/2cup," Egg Scrambled Mix Frozen  (Whole Eggs, Reconstituted Nonfat Dry Milk, Egg Whites, Corn Oil, Salt, Xanthan Gum, Citric Acid, Natural Flavoring, Annatto  (A Natural Color).), Canola Oil  (Canola Oil With TBHQ And Citric Acid Added To Help Protect Flavor. Dimethylpolysiloxane, An Antifoaming Agent, Added.)"
1,1,Homestyle Sausage Gravy,"['Gluten', 'Milk', 'Wheat']",/menus/item/3891b961-abf7-41b6-aa9d-c9fa93a68273,140,4 ozladle," 2% Milk  (Grade A Reduced Fat Milk, Vitamin A Palmitate & Vitamin D3.), Pork Sausage  (Pork Boston Butt, Water, Seasoning Sausage Mild  (Blended of Salt, Red Pepper, Sage, Sugar, And Black Pepper).), Flour All Purpose H&R Gold Medal  (Bleached Wheat Flour, Malted Barley Flour, Niacin, Iron, Thiamin Mononitrate, Riboflavin, Folic Acid.), Coarse Kosher Salt  (Salt, Yellow Prussiate Of Soda), Crushed Red Pepper  (Crushed Red Pepper)"
2,2,Buttermilk Biscuit,"['Gluten', 'Milk', 'Wheat', 'Vegetarian']",/menus/item/6c7e0713-3cb7-4b9c-ab9e-d6f961498aee,259,1biscuit," Enriched Flour Bleached  (Wheat Flour, Malted Barley Flour, Niacin, Iron, Thiamin Mononitrate, Riboflavin, Folic Acid), Water, Vegetable Oil  (Palm And/Or Palm Kernel Oil), Sugar, Buttermilk, Baking Soda, Salt, Sodium Aluminum Phosphate, Sodium Acid Pyrophosphate, Modified Corn Starch, Pectin, Whey Protein."
3,3,Sausage Links,[],/menus/item/c175e6a0-5ce1-44b9-92bf-0df9b8efba68,180,2each," Sausage Link Cooked 20/# IP 83028  (Pork, Water, Salt, Dextrose, Flavorings  (Spices And Spice Extractives) Citric Acid, Propyl Gallate.)"
4,4,Breakfast Red Potatoes,"['Soy', 'Vegan', 'Vegetarian']",/menus/item/9ae04007-d231-4a73-98fb-b6ddc3a436c2,95,1/2cup," Potato Red B Size Quartered, Yellow Onion, Oil Liquid Butter Alternative Gal  (Soybean Oil, Hydrogenated Soybean Oil, Salt, Soy Lecithin, Natural And Artificial Flavor, TBHQ And Citric Acid Added To Protect Flavor, Beta Carotene  (Color), And Dimethylpolysiloxane Added To Reduce Foaming.), Iodized Salt  (Salt, Sodium Silicoaluminate, Dextrose, Potassium Iodine), Spice Paprika Spanish  (Paprika), Spice Pepper Black Ground 18 oz  (Black Pepper)"
5,5,Hard Cooked Eggs,"['Eggs', 'Vegetarian']",/menus/item/53c93b77-2eaa-4c19-8e30-5c4885a3bc01,68,1egg, Eggs  (Large Shell Egg)
6,6,Cocoa Banana Muffin,"['Eggs', 'Gluten', 'Milk', 'Soy', 'Wheat', 'Vegetarian']",/menus/item/d006623e-24b5-4c3c-aae8-e1f1b0d0e224,1105,1each," Cereal Oats Quick  (Whole Grain Rolled Oats.), Banana, >or Pulp=, Flour All Purpose H&R Gold Medal  (Bleached Wheat Flour, Malted Barley Flour, Niacin, Iron, Thiamin Mononitrate, Riboflavin, Folic Acid.), Milk Skim, Brown Sugar  (Sugar, Cane Molasses), Margarine  (Vegetable Oil Blend  (Palm Oil And Soybean Oil), Water, Salt, Contains Less Than 2% Of Soy Lecithin, Vegetable Mono Diglycerides, Potassium Sorbate  (A Preservative), Citric Acid, Natural Artificial Flavor, Beta Carotene  (Color), Vitamin A Palmitate Added, Whey.), Egg White Frozen  (Egg Whites, Guar Gum.), Cocoa Powder  (Cocoa Processed With Alkali.), Baking Powder 4 x 10#  (Sodium Acid Pyrophosphate, Sodium Bicarbonate, Corn Starch, Monocalcium Phosphate), Flavor Vanilla Imitation  (Water, Caramel Color, Artifical Flavor, Citric Acid, Sodium Benzoate  (Preservative).), Baking Soda 24 x 1#  (Sodium Bicarbonate)"
7,7,Vanilla Yogurt,"['Milk', 'Vegetarian']",/menus/item/daa10a62-6836-4035-9707-1090624cfa18,80,1/2cup," Cultured Grade A Non Fat Milk, Cane Sugar, Modified Food Starch, Water, Contains Less Than 1% Of Natural Flavors, Vegetable Juice  (For Color), Agar Agar, Citric Acid, Sodium Citrate, Potassium Sorbate  (To Maintain Freshness), Vitamin D3 Contains Live And Active Cultures: S. Thermophilus L. Bulgaricus."
8,8,Strawberry Yogurt,"['Milk', 'Vegetarian']",/menus/item/1df0c1d1-8339-4f7e-abcb-e59873c05c0e,80,1/2cup," Cultured Grade A Non Fat Milk, Cane Sugar, Water, Modified Food Starch, Contains Less Than 1 Of Natural Flavors, Beta Carotene And Black Carrot Juice Concentrate For Color, Malic Acid, Sodium Citrate, Potassium Sorbate To Maintain Freshness, Vitamin D3, Contains Active Yogurt Cultures: S. Thermophilus L. Bulgaricus."
9,9,Mango Chunks,"['Vegan', 'Vegetarian']",/menus/item/cec2dfa6-4f39-4a7e-b143-e77da17a1e8f,92,3/4 cupportion, Mango Cubes  (Mango.)
10,10,Pear Slices,"['Vegan', 'Vegetarian']",/menus/item/712c26a1-c09c-47b6-ad60-f7de83e986c3,38,1/2cup," Pear Slices  (Pears, Water, Corn Syrup, Sugar)"
11,11,Oatmeal,"['Gluten', 'Vegan', 'Vegetarian']",/menus/item/6ea795d3-67d5-4a39-9e81-d2ee5e9e64aa,80,1/2cup," Water  (Water), Cereal Oats Kettle Hearty  (Whole Grain Rolled Oats.), Iodized Salt  (Salt, Sodium Silicoaluminate, Dextrose, Potassium Iodine)"
12,12,Vegetarian Congee,"['Vegan', 'Vegetarian']",/menus/item/453c6a1e-202d-42e6-9959-75ac20dc61be,77,1cup," Water  (Water), Rice Long Grain  (Long Grain Rice Enriched With Iron  (Ferric Orthophosphate), Niacin, Thiamin  (Thiamin Mononitrate), And Folic Acid.), Ginger Root 30# Case  (Ginger Root.), Coarse Kosher Salt  (Salt, Yellow Prussiate Of Soda), Ground White Pepper"
13,13,Sliced Strawberries,"['Vegan', 'Vegetarian']",/menus/item/750cc1ef-6d71-4151-8598-fbe7d59d46bb,127,#8disher," Sliced Strawberries  (Strawberries, Sugar.)"
14,14,Blueberries,"['Vegan', 'Vegetarian']",/menus/item/16c699f3-c01d-48c7-bfde-5d8e68a530bb,44,1/2cup, Blueberries.
15,15,Dried Bing Cherries,"['Vegan', 'Vegetarian']",/menus/item/8e547c58-ec5f-4da4-b586-b95c7fbddfef,92,1ounce," Cherries, Sugar, Sunflower Oil."
16,16,Raisins,"['Vegan', 'Vegetarian']",/menus/item/7e996c16-3fa7-4a44-9ac4-79bbd2d3a441,27,1tablespoon, Raisins
17,17,Brown Sugar,"['Vegan', 'Vegetarian']",/menus/item/39b5d44e-1d1c-47bf-991e-51923f251e19,53,1tablespoon," Granulated Sugar, Refined Cane Molasses Syrup."
18,18,Whipped Cream Cheese ,"['Milk', 'Vegetarian']",/menus/item/65649d5f-104a-4f88-ad8e-1ca0b92df94f,24,1tablespoon," Pasteurized Milk And Cream, Skim Milk, Whey Protein Concentrate, Whey, Modified Food Starch, Salt, Carob Bean Gum, Xanthan Gum, Guar Gum, Lactic Acid, Natamycin  (A Natural Mold Inhibitor), Vitamin A Palmitate, Cheese Culture"
19,19,Whipped Butter,"['Milk', 'Vegetarian']",/menus/item/d2610609-333a-4b5f-9080-dbc40805991a,102,1tablespoon," Butter Solids  (Pasteurized Cream, Salt)"
20,20,Whipped Margarine,"['Milk', 'Soy', 'Vegetarian']",/menus/item/36c2e392-d4f9-44e3-ac6e-09ff62ecbc83,101,1tablespoon," Margarine  (Vegetable Oil Blend  (Palm Oil And Soybean Oil), Water, Salt, Contains Less Than 2% Of Soy Lecithin, Vegetable Mono Diglycerides, Potassium Sorbate  (A Preservative), Citric Acid, Natural Artificial Flavor, Beta Carotene  (Color), Vitamin A Palmitate Added, Whey.)"
21,21,Crunchy Peanut Butter,"['Peanuts', 'Soy', 'Vegan', 'Vegetarian']",/menus/item/2f79f0ae-686f-47a5-b7c5-15a1d430cc1d,92,1tablespoon," Roasted Peanuts And Sugar, Contains 2% Or Less Of: Molasses, Fully Hydrogenated Vegetable Oils  (Rapeseed And Soybean), Mono And Diglycerides, Salt."
22,22,Creamy Peanut Butter,"['Peanuts', 'Soy', 'Vegan', 'Vegetarian']",/menus/item/1bf25d09-e2dc-4437-818d-c5b55f5c56e8,94,1tablespoon," Roasted Peanuts And Sugar, Contains 2% Or Less Of Molasses, Fully Hydrogenated Vegetable Oils  (Rapeseed And Soybean), Mono And Diglycerides, Salt."
23,23,Grape Jelly,"['Vegan', 'Vegetarian']",/menus/item/e2580868-4a79-4eaf-be27-0e18f7c5588b,50,1tablespoon," Concord Grapes, Corn Syrup, High Fructose Corn Syrup, Pectin, Citric Acid, Sodium Citrate."
24,24,Strawberry Jelly,"['Vegan', 'Vegetarian']",/menus/item/47335b2c-9e91-4368-8541-1801cd4e929f,50,1tablespoon," Strawberries, High Fructose Corn Syrup, Corn Syrup, Sugar, Fruit Pectin, Citric Acid, Red Grape Juice Concentrate  (For Color), Natural Flavor."
25,25,Plain Bagel,"['Gluten', 'Soy', 'Wheat', 'Vegan', 'Vegetarian']",/menus/item/991aa015-3197-46d7-af1b-6413a030070c,253,1bagel," Enriched Flour  (Wheat Flour, Malted Barley, Niacin, Reduced Iron, Thiamine Mononitrate, Riboflavin, Folic Acid), Water, Sugar, Yeast, Contains Less Than 2% Of Each Of The Following: Salt, Wheat Gluten, Calcium Propionate  (A Preservative), Guar Gum, Soybean Oil, Wheat Flour, Sodium Stearoyl Lactylate, Monoglycerides, Citric Acid  (A Preservative), Sorbic Acid  (A Preservative), Enzymes, Hydrogenated Soybean Oil, Degerminated Yellow Corn Meal, Ascorbic Acid  (A Preservative)."
26,26,Blueberry Bagel,"['Gluten', 'Soy', 'Wheat', 'Vegan', 'Vegetarian']",/menus/item/37f56aa1-a123-4a27-88dc-90e96a8b9ea5,226,1bagel," Enriched Flour  (Wheat Flour, Malted Barley Flour, Niacin, Reduced Iron, Thiamine Mononitrate, Riboflavin, Folic Acid), Water, Sugar, Yeast, Wheat Gluten, Contain Less Than 2% Of Each Of The Following: Dextrose, Wheat Flour, Salt, Degerminated Yellow Corn Meal, Soybean Oil, Calcium Propionate  (Preservative), Guar Gum, Sodium Stearoyl Lactylate, Medium Chain Triglycerides, Monoglycerides, Natural And Artificial Flavors, Citric Acid  (Preservative), Sorbic Acid  (Preservative), Enzymes, Red 40 Lake, Hydrogenated Soybean Oil, Blue 2 Lake, Dried Blueberries  (Blueberries, Maltodextrin, Corn Starch), Blue 1 Lake, Red 40, Ascorbic Acid  (Preservative)."
27,27,White Bread,"['Gluten', 'Milk', 'Sesame', 'Soy', 'Wheat', 'Vegetarian']",/menus/item/91018895-f02e-4f9d-9107-0acf8b0dea4a,1782,24 ozloaf," Enriched Flour [Unbleached Wheat Flour, Malted Barley Flour, Reduced Iron, Thiamine Mononitrate  (Vitamin B1), Riboflavin  (Vitamin B2), Niacin  (Vitamin B3), Folic Acid], Water, High Fructose Corn Syrup, Yeast, Soybean Oil, Salt, Modified Whey, Vinegar, Wheat Starch, Monoglycerides, Wheat Protein Isolate, Calcium Propionate  (A Preservative), Lactic Acid, Natural Flavors, Sodium Stearoyl Lactylate, Calcium Sulfate, Calcium Phosphate, Ascorbic Acid, Sesame."
28,28,Wheat Bread,"['Gluten', 'Milk', 'Sesame', 'Soy', 'Wheat', 'Vegetarian']",/menus/item/ad4cd8db-5445-414d-8960-f0acc58f9030,85,1slice," Enriched Flour [Unbleached Wheat Flour, Malted Barley Flour, Reduced Iron, Thiamine Mononitrate  (Vitamin B1), Riboflavin  (Vitamin B2), Niacin  (Vitamin B3), Folic Acid], Water, Whole Grain Wheat Flour, Yeast, Sugar, Wheat Bran, Wheat Gluten, Soybean Oil, Whole Grain Rolled Oats, Rye Flour, Barley Flakes, Salt, Molasses, Monoglycerides, Modified Whey, Calcium Propionate  (A Preservative), Vinegar, Sodium Stearoyl Lactylate, Dextrose, Natural Flavor, Wheat Starch, Calcium Sulfate, Calcium Phosphate, Ascorbic Acid, Citric Acid, Sesame; Topped With Butter."
29,29,English Muffin,"['Gluten', 'Soy', 'Wheat', 'Vegan', 'Vegetarian']",/menus/item/a92c1b04-bc3c-42a0-80f8-58dc8a0fa90c,129,1muffin," Enriched Wheat Flour  (Wheat Flour, Malted Barley Flour, Niacin, Reduced Iron, Thiamine Mononitrate, Riboflavin, Folic Acid), Water, Yeast, Contains Less Than 2% Of: Ascorbic Acid, Calcium Propionate And Potassium Sorbate  (Preservatives), Fumaric Acid, Yellow Corn Flour, Yellow Cornmeal, Datem, Calcium Silicate, Enzymes, Salt, Soybean Oil, Sugar, Citric Acid, Wheat Gluten, Vinegar."
30,30,Pancakes,"['Eggs', 'Gluten', 'Milk', 'Wheat', 'Vegetarian']",/menus/item/f084c83e-9700-4194-ba87-1c9ddf1a08bd,66,1pancake," Enriched Bleached Wheat Flour  (Niacin, Reduced Iron, Thiamine Mononitrate, Riboflavin, Folic Acid), Sugar, Milk Powder, Wheat Starch, Egg Powder, Corn Starch, Monocalcium Phosphate, Sodium Bicarbonate, Salt."
31,31,Sugar Free Maple Pancake Syrup,"['Vegan', 'Vegetarian']",/menus/item/f9e263f1-07a5-4b93-8a7e-d9681120e628,15,1/4cup," Water, Sorbitol, Contains 2% Or Less Of: Cellulose Gum, Salt, Caramel Color, Xanthan Gum, Sorbic Acid And Sodium Benzoate  (Preservatives), Acesulfame Potassium  (Non Nutritive Sweetener), Natural And Artificial Flavor, Sodium Hexametaphosphate, Phosphoric Acid, Sucralose  (Non Nutritive Sweetener)."
32,32,Pancake Syrup,"['Vegan', 'Vegetarian']",/menus/item/0c48bf1f-1804-4f89-b55c-4b9269cd66ba,35,1tablespoon," Corn Syrup, Water, Natural And Artificial Maple Flavor, Salt, Carboxymethyl Cellulose, Sodium Benzoate And Potassium Sorbate  (As Preservatives), Caramel Color."
33,33,GF Blueberry Muffin,"['Eggs', 'Vegetarian']",/menus/item/376f78d1-56ce-44ce-963a-c6710560c654,270,1each," Cane Sugar, Eggs, Water, Tapioca Starch, Brown Rice Flour  (Rice Flour And Rice Bran). Blueberries, Canola Oil, Potato Starch, Sugar, Palm Oil, Dried Blueberries, Baking Powder  (Sodium Acid  Pyrophosphate, Sodium Bicarbonate, Corn Starch, Monocalcium Phosphate), Natural Flavor, Salt, Sunflower Lecithin, Lemon Flavedo  (Lemon Peel, Cane Sugar, Lemon Oil Essence), Xanthan Gum"
34,34,White Bread GF,['Eggs'],/menus/item/4ff6bcd3-d44e-445d-bc02-6243c876440b,121,1slice," Water, Pea Starch, Modified Tapioca Starch, Rice Starch, Canola Oil, Rice Flour, Sorghum Flour, Tapioca Starch, Invert Cane Sugar, Egg Whites, Cane Sugar, Modified Cellulose, Apple Cider Vinegar, Salt, Yeast, Cultured Brown Rice, Brown Rice, Guar Gum, Xanthan Gum, Enzymes."
35,35,Rice Chex Cereal,"['Vegan', 'Vegetarian']",/menus/item/fa5ba527-3a4a-4478-96bb-0225d44a4435,101,1cup," Rice, Whole Grain Rice, Sugar, Salt, Molasses, Vitamin E (Mixed Tocopherols) And BHT Added To Preserve Freshness. Vitamins And Minerals: Calcium Carbonate, Iron And Zinc  (Mineral Nutrients), Vitamin C  (Sodium Ascorbate) A B Vitamin  (Niacinamide), Vitamin B6  (Pyridoxine Hydrochloride) Vitamin B2  (Riboflavin), Vitamin B1  (Thiamin Mononitrate), Vitamin A  (Palmitate), A B Vitamin  (Folic Acid), Vitamin B12, Vitamin D"
36,36,Plain Bagel GF,"['Eggs', 'Vegetarian']",/menus/item/8a887719-a700-41fe-af71-88b38c6dc70c,250,1bagel," Water, Brown Rice Flour  (Rice Flour, Rice Bran With Germ), Tapioca Starch, Canola Oil, Egg Whites, Potato Starch, Sugar, Tapioca Maltodextrin, Tapioca Syrup, Pea Protein, Contains Less Than 2% Of The Following: Xanthan Gum, Salt, Yeast, Cultured Corn Syrup Solids, Citric Acid  (Mold Inhibitor), Enzymes."
37,37,Grilled Cheese,"['Gluten', 'Milk', 'Sesame', 'Soy', 'Wheat', 'Vegetarian']",/menus/item/ea76adaf-1daa-4b93-9cf3-36d1422699a8,339,1sandwich," White Bread  (Enriched Flour [Unbleached Wheat Flour, Malted Barley Flour, Reduced Iron, Thiamine Mononitrate  (Vitamin B1), Riboflavin  (Vitamin B2), Niacin  (Vitamin B3), Folic Acid], Water, High Fructose Corn Syrup, Yeast, Soybean Oil, Salt, Modified Whey, Vinegar, Wheat Starch, Monoglycerides, Wheat Protein Isolate, Calcium Propionate  (A Preservative), Lactic Acid, Natural Flavors, Sodium Stearoyl Lactylate, Calcium Sulfate, Calcium Phosphate, Ascorbic Acid, Sesame.), American Cheese  (Cultured Milk And Skim Milk, Cream, Sodium Citrate, Salt, Color Added, Sorbic Acid  (Preservative), Enzymes, Soy Lecithin  (Non-Sticking Agent).), Oil Liquid Butter Alternative Gal  (Soybean Oil, Hydrogenated Soybean Oil, Salt, Soy Lecithin, Natural And Artificial Flavor, TBHQ And Citric Acid Added To Protect Flavor, Beta Carotene  (Color), And Dimethylpolysiloxane Added To Reduce Foaming.)"
38,38,Crinkle Cut Fries,"['Soy', 'Vegan', 'Vegetarian']",/menus/item/1a5dd07f-834b-4465-8d4b-b2f4fcae7e01,126,4oz," Potato French Fry Crinkle Cut  (Potatoes, Vegetable Oil  (Soybean, Canola, Cottonseed, And/Or Sunflower), Contains 2% Or Less Of: Dextrose, Disodium Dihydrogen Pyrophosphate  (To Maintain Natural Color).)"
39,39,Chunky Tomato Basil Soup,"['Gluten', 'Milk', 'Soy', 'Wheat', 'Vegetarian']",/menus/item/d02b2362-4e18-465f-a765-ba0c046c1b4a,153,6 ozladle," Water  (Water), Tomato Puree 6 x #10  (Tomato Puree  (Water, Tomato Paste), Citric Acid.), Tomato Diced 6 x #10  (Tomatoes, Tomato Juice, Less Than 2% Of: Salt, Calcium Chloride, Citric Acid.), Juice Tomato 46 oz  (Tomato Juice From Concentrate  (Water, Tomato Concentrate), Salt, Vitamin C  (Ascorbic Acid), Citric Acid.), Heavy Cream  (Cream  (Milk), Carrageenan.), Yellow Onion, Flour All Purpose H&R Gold Medal  (Bleached Wheat Flour, Malted Barley Flour, Niacin, Iron, Thiamin Mononitrate, Riboflavin, Folic Acid.), Margarine  (Vegetable Oil Blend  (Palm Oil And Soybean Oil), Water, Salt, Contains Less Than 2% Of Soy Lecithin, Vegetable Mono Diglycerides, Potassium Sorbate  (A Preservative), Citric Acid, Natural Artificial Flavor, Beta Carotene  (Color), Vitamin A Palmitate Added, Whey.), Base Vegetable Mirepoix Sauteed 6 x 1#  (Sauteed Vegetable Puree Mix  (Carrots, Onions, Celery), Salt, Sugar, Maltodextrin, Corn Oil, Less Than 2% Of Yeast Extract, Water, Potato Starch, Xanthan Gum, Natural Flavors, Carrot Juice Concentrate.), Granulated Sugar  (Sugar.), Fresh Basil  (Fresh Basil)"
40,41,Korean Pulled Pork,"['Sesame', 'Soy']",/menus/item/1498b659-8b00-4c43-a220-ece23d76bad9,353,4oz," Austin Blues Pulled Pork  (Smoked Cooked Pork, Cider Vinegar, Sugar, Salt, Spices.), Sauce Taco Korean  (Sauce Soy Tamari GF  (Water, Soybeans, Salt, Alcohol  (To Preserve Freshness).), Brown Sugar  (Sugar, Cane Molasses), Sauce Garlic Chili 3x1 Gal  (Chili, Salt, Garlic, Distilled Vinegar, Potassium Sorbate And Sodium Bisulfate As Preservatives, And Xanthan Gum.), Garlic Chopped  (Minced Garlic  (Peeled Garlic)), Oil Sesame 6 x 61 oz  (100% Pure Sesame Oil.), Ginger Root 30# Case  (Ginger Root.), Crushed Red Pepper  (Crushed Red Pepper))"
41,42,Korean Fried Tofu Cubes,"['Sesame', 'Soy', 'Vegan', 'Vegetarian']",/menus/item/81f84191-161e-4ddb-9579-d2298311278d,66,1ounce," Tofu  (Non-GMO Soybeans, Water, Calcium Sulfate, Glucono Delta Lactone  (GDL).), Sauce Soy Tamari GF  (Water, Soybeans, Salt, Alcohol  (To Preserve Freshness).), Cornstarch  (Corn Starch.), Brown Sugar  (Sugar, Cane Molasses), Sauce Garlic Chili 3x1 Gal  (Chili, Salt, Garlic, Distilled Vinegar, Potassium Sorbate And Sodium Bisulfate As Preservatives, And Xanthan Gum.), Oil Sesame 6 x 61 oz  (100% Pure Sesame Oil.), Ginger Root 30# Case  (Ginger Root.), Crushed Red Pepper  (Crushed Red Pepper), Garlic Chopped  (Minced Garlic  (Peeled Garlic))"
42,43,Long Grain Rice,"['Vegan', 'Vegetarian']",/menus/item/9e6eb50a-0778-49fd-a84e-d9d476f1a297,122,1/2 cup," Water  (Water), Rice Long Grain  (Long Grain Rice Enriched With Iron  (Ferric Orthophosphate), Niacin, Thiamin  (Thiamin Mononitrate), And Folic Acid.)"
43,44,Flour Tortilla ,"['Gluten', 'Soy', 'Wheat', 'Vegan', 'Vegetarian']",/menus/item/015eec36-22db-4d57-b899-915765bfbd26,127,1tortilla," Enriched Bleached Flour  (Flour, Niacin, Reduced Iron, Thiamine Mononitrate, Riboflavin, Folic Acid), Water, Vegetable Shortening  (Interesterified And Hydrogenated Soybean Oils), Contains 2% Or Less Of: Salt, Baking Soda, Sodium Acid Pyrophosphate, Distilled Monoglycerides, Enzymes, Cellulose Gum, Fumaric Acid, And Calcium Propionate And Sorbic Acid  (To Maintain Freshness)."
44,45,Tri Color Tortilla Chips,"['Vegan', 'Vegetarian']",/menus/item/c4882a61-3c2b-439e-bb7b-90dfd20053c1,12,1ounce," Whole Grain Corn, Water, Contains 2% Or Less Of: Guar Gum, Cellulose Gum, Dextrose, Red 40 Lake, Blue , Yellow 5, Yellow 6, Propylene Glycol, Xanthan Gum, Enzymes, and Propionic Acid, Benzoic Acid and Phosphoric Acid to Maintain Freshness."
45,46,Pickled Cucumbers,"['Vegan', 'Vegetarian']",/menus/item/77492629-1a36-412d-99d1-a29a01d5e30e,447,1/2cup," Cucumber  (Cucumber.), Rice Vinegar  (Rice Vinegar (Water, Rice)), Water  (Water), Granulated Sugar  (Sugar.), Iodized Salt  (Salt, Sodium Silicoaluminate, Dextrose, Potassium Iodine), Sauce Garlic Chili 3x1 Gal  (Chili, Salt, Garlic, Distilled Vinegar, Potassium Sorbate And Sodium Bisulfate As Preservatives, And Xanthan Gum.)"
46,47,Cilantro,"['Vegan', 'Vegetarian']",/menus/item/e89327ff-5979-4c09-9b2c-7122dea335ec,1,1tablespoon, Cilantro
47,48,Kimchee,"['Vegan', 'Vegetarian']",/menus/item/6ef54b98-dd3e-4321-9dd8-e4a01503eadb,24,1/2cup," Cabbage Napa Crate  (Cabbage Napa.), Matchstick Carrots, Spice Pepper Hot Powder 5#  (Dried Red Pepper), Vinegar Apple Cider  (Made From The Juices Of Apples, Diluted With Water To A Uniform Pickling And Table Strength Of 5%  (50 Grains) Acidity.), Green Onion  (Onion Green), Granulated Sugar  (Sugar.), Minced Garlic  (Peeled Garlic), Iodized Salt  (Salt, Sodium Silicoaluminate, Dextrose, Potassium Iodine), Ginger Root 30# Case  (Ginger Root.)"
48,49,Lime Wedges,"['Vegan', 'Vegetarian']",/menus/item/1850cbe7-d6d1-4572-918b-83cad6dd1bb7,4,1wedge, Limes 36 Ct.  (Lime Fresh)
49,50,Mild Salsa,"['Vegan', 'Vegetarian']",/menus/item/ffe53c8f-387e-44ef-8474-8ae0021c7edd,1007,#10can," Tomato Puree, Diced Tomatoes In Tomato Juice, Jalapenos, Distilled Vinegar, Contains Less Than 2% Of: Dehydrated Onion, Salt, Sea Salt, Natural Flavors, Sugar, Dehydrated Garlic, Vitamin C  (Ascorbic Acid), Spices, Vitamin E  (DL-Alpha Tocopheryl Acetate), Vitamin A  (Retinol Palmitate)."
50,51,Queso Blanco Cheese Sauce w Salsa Verde,"['Milk', 'Vegetarian']",/menus/item/cd737c62-b163-473f-aa1c-148c085fcd17,218,1/2cup," Water, Cheddar Cheese Pasteurized Milk, Cheese Culture, Salt, Enzymes, Cream, Tomatillos With Citric Acid, Contains Less Than 2 Of Green Chiles With Citric Acid, Modified Food Starch, Sodium Phosphates And Potassium Phosphates, Jalapeno Peppers With Salt, Acetic Acid, Water, Calcium Chloride, Salt, Seasoning Potassium Chloride, Flavor  (Contains Maltodextrin), Onions, Dehydrated Garlic, Citric Acid, Dehydrated Cilantro."
51,52,Roasted Bok Choy,"['Vegan', 'Vegetarian']",/menus/item/fa95d296-55b6-4f87-b949-c2ed684b1c31,25,4oz," Cabbage Bok Choy Baby 30#  (Cabbage Bok Choy.), Canola Oil  (Canola Oil With TBHQ And Citric Acid Added To Help Protect Flavor. Dimethylpolysiloxane, An Antifoaming Agent, Added.), Coarse Kosher Salt  (Salt, Yellow Prussiate Of Soda)"
52,53,Tortilla Chips,"['Vegan', 'Vegetarian']",/menus/item/538f6f1b-e266-42da-bb57-4e96da5d6353,142,1ounce," Corn, Vegetable Oil  (Corn, Canola And/Or Sunflower Oil), And Salt."
53,54,Jalapeno Popper Dip,"['Eggs', 'Gluten', 'Milk', 'Soy', 'Wheat', 'Vegetarian']",/menus/item/79723909-c4cf-4c76-aa95-cef81c8d12f1,207,1/4cup," Cream Cheese  (Pasteurized Milk And Cream, Whey Protein Concentrate, Whey, Salt, Carob Bean Gum, Xanthan Gum, Guar Gum, Natamycin A Natural Mold Inhibitor, Vitamin A Palmitate, Cheese Culture.), Mayonnaise  (Soybean Oil, Vinegar, Eggs, Water, Salt, Egg Yolks, Sugar, Calcium Disodium EDTA  (To Protect Flavor), Dried Garlic, Dried Onions, Natural Flavor.), Shredded Cheese  (Paseurized Milk, Cheese Cultures, Salt, Enzymes.), Jalapeno Pepper Rings  (Jalapeno Peppers, Water, Vinegar, Salt, Calcium Chloride, Sodium Benzoate  (Preservative), Sodium Metabisulfite  (Preservative), Yellow 5), Japanese Bread Crumbs  (Wheat Flour, Sugar, Salt, Dried Yeast, Caramel  (Color), Calcium Propionate, Soybean Oil, and Turmeric Extract  (Color).)"
54,55,Buffalo Chicken Dip ,"['Eggs', 'Milk', 'Soy']",/menus/item/08f9ff1f-3894-4a9a-8adb-36d2894c46df,115,1/4cup," Chicken Pulled 2 x 5#  (Dark Chicken Meat, Water, Tomatoes  (Water, Tomato Paste), Seasoning  (Salt, Sugar, Spices, Dehydrated Garlic, Xanthan Gum, Mustard, Dehydrated Onion, Corn Syrup Solids, Paprika, Canola Oil, Chili Pepper, Lemon Juice Solids, Natural Flavors, Garlic Powder), Chicken Fat, Sodium Phosphates, Rice Flour, Chicken Type Flavor  (Autolyzed Yeast Extract, Flavors, Salt, Chicken Fat), Chili Powder  (Chili Peppers, Flavoring), Curry Powder  (Spices, Turmeric).), Cream Cheese  (Pasteurized Milk And Cream, Whey Protein Concentrate, Whey, Salt, Carob Bean Gum, Xanthan Gum, Guar Gum, Natamycin A Natural Mold Inhibitor, Vitamin A Palmitate, Cheese Culture.), Frank's Red Hot Buffalo Sauce  (Distilled Vinegar, Aged Cayenne Red Peppers, Salt, Water, Canola Oil, Paprika, Xanthan Gum, Natural Butter Type Flavor, And Garlic Powder.), Ranch Dressing  (Soybean Oil, Water, Vinegar, Buttermilk, Sugar, Egg Yolk Salt, Contains Less Than 2% Of The Following: Modified Food Starch, Dried Whey, Xanthan Gum, Dried Garlic, Died Onions, Spice, Phosphoric Acid, Disodium Guanylate, Disodium Inosinate, Sorbic Acid And Calcium Disodium EDTA  (To Protect Flavor)..), Shredded Cheddar Cheese  (Pasteurized Milk, Cheese Culture, Salt, Enzymes, And Annatto  (Color) When Applicable.), Spice Buffalo Burger Rub  (Blended Of Salt, Spices, Sodium Phosphates  (15.79%), Sugar, Modified Food Starch, Vinegar, Powder Garlic, Onion Powder, Spice Extractives.)"
55,56,Pork & Broccoli Stir Fry,"['Gluten', 'Shellfish', 'Soy', 'Wheat']",/menus/item/3734e152-9605-4b3f-86ac-e307a351d0e8,191,3/4cup," Broccoli Florets  (Broccoli.), Pork Stir Fry 1/2""  (90% Or Better Extra Lean Pork), Matchstick Carrots, Sauce Oyster 6 x 5#  (Water, Sugar, Salt, Oyster Extractives  (Oyster, Water, Salt), Salt, Modified Corn Starch, Monosodium Glutamate, Wheat Flour, Caramel Color.), Canola Oil  (Canola Oil With TBHQ And Citric Acid Added To Help Protect Flavor. Dimethylpolysiloxane, An Antifoaming Agent, Added.), Granulated Sugar  (Sugar.), Garlic Chopped  (Minced Garlic  (Peeled Garlic)), Sauce Soy Mushroom 12 x 5#  (Water, Soybeans, Sugar, Salt, Wheat Flour, Extract Of Mushroom, Sulfur Dioxide.)"
56,57,Pork Potstickers,"['Gluten', 'Sesame', 'Soy', 'Wheat']",/menus/item/42b630fd-51b0-499e-a413-a7d55dc91b34,53,1each," Appetizer Potsticker Pork Vegetable  (Filling: Pork, Cabbage, Green Onion, Sugar, Corn Starch, Salt, Soy Sauce  (Water, Wheat, Soybeans, Salt), Garlic, Sesame Seed Oil, Ginger, Yeast Extract, Black Pepper. Wrapper: Enriched Unbleached Flour  (Wheat Flour, Niacin, Reduced Iron, Thiamine Mononitrate, Riboflavin, Folic Acid), Water, Food Starch, Salt, Soybean Oil.)"
57,58,Potsticker Sauce,"['Gluten', 'Sesame', 'Shellfish', 'Soy', 'Wheat']",/menus/item/ee307a2c-6f3d-47c1-a828-ad5085d60150,18,1tablespoon," Water  (Water), Sauce Soy Tamari GF  (Water, Soybeans, Salt, Alcohol  (To Preserve Freshness).), Vinegar White, Granulated Sugar  (Sugar.), Sauce Oyster 6 x 5#  (Water, Sugar, Salt, Oyster Extractives  (Oyster, Water, Salt), Salt, Modified Corn Starch, Monosodium Glutamate, Wheat Flour, Caramel Color.), Oil Sesame 6 x 61 oz  (100% Pure Sesame Oil.), Garlic Chopped  (Minced Garlic  (Peeled Garlic)), Ginger Root 30# Case  (Ginger Root.)"
